11559507,Apple Magic Keyboard,APPLE,"Clavier et étui - avec trackpad - Apple Smart connector - QWERTY - Anglais US - pour 10.9-inch iPad Air (4ème génération, 5ème génération); 11-inch iPad Air (M2, M3)",274.17,,,,,,Clavier intégré,Trackpad,,,,,,,,,,,,,,,,,,,"10.9-inch iPad Air (4ème génération, 5ème génération); 11-inch iPad Air (M2, M3)",,,,,,,,,,,,,,"Volume, luminosité",,,,,,,1 an de garantie,,,,Apple Smart connector,,,,,,,QWERTY Anglais US,,,,,,,,,,,,,,,,,,,,,,,,,,,,,,,"Protection arrière, protection avant",,,,,,,,,,,,,,,,,,,,,,,,,Filaire,,,,,,,,,,,,,,,,,,,,,
10288541,HP 220,HP INC,Clavier - sans fil - 2.4 GHz - Français - noir - emballage recyclable,13.5,,,,,,,,,,,,,,,,,,,,,,,,,,,Noir,,,,,,,,,,,,,,,,,,,,Garantie de 2 ans,,,,2.4 GHz,,,,,,,Français,,,,,,,,,,,,,,,,,,,,,,,,,425.5 g,,,,,,,,,,,,Récepteur sans fil USB,,,,,,,,,,,,,,,,,,,Sans fil,,,,,,,,Emballage recyclable,,,,,,,,,,,,,
11536837,CHERRY G80-3000,CHERRY,"3000 - Clavier - PS/2, USB - US - commutateur : CHERRY MX Brown - noir",121.84,,,,,,,,,,,,,,Oui,,,,,,,,,,,,,Noir,,,,,,,,,,,,,,,,,,,,Garantie de 3 ans,,,,"PS/2, USB",,,,,,,US,,,,,,,,,,,,104,,,,,,,,,,,,,935 g,,,,,,,,,,,,,,,,,,,,,,,,,,,,,,,Filaire,,,,,,,,,,,CHERRY MX Brown,,,,,,,,,,
10379454,Apple Magic Keyboard,APPLE,Clavier et étui - avec trackpad - rétroéclairé - Apple Smart connector - QWERTY - US - noir,290.83,,,,,,Clavier intégré,Trackpad,,,,,,,,,,,,,,,,,,,,Noir,,,,,,,,,,,,,"Volume, luminosité",,,,,,,1 an de garantie,,,,Apple Smart connector,,,,,,,QWERTY US,,,,,,,,,,,,,,,,,,,,,,,,,,,,,,,"Protection arrière, protection avant",,,,,,,,,,,,Oui,,,,,,,,,,,,,Filaire,,,,,,,,,,,,,,,,,,,,,
10311699,XtremeMac Travel,MCL SAMAR,Clavier - pliable - avec pavé tactile - sans fil - Bluetooth 3.0 - QWERTY - US - gris sidéral - Pour la vente au détail - boîte,58.31,,,,,,,Pavé tactile,,,,,,,,,,,,,,,,,,,,Gris sidéral,,,,,,,,,,,,,,,,,,,,,,,,Bluetooth 3.0,,,,,,,QWERTY US,,,,,,,,,,,,,,,,,,,,,,,,,,,,,,,,,,,,,,,,,,,,,,,,,,,,,,,,Sans fil,,,,,,,,Pour la vente au détail - boîte,,,,,,,,,,,,,
11841031,HyperX Pudding Keycaps,HP INC,"Set de touches pour clavier - full key set, FR layout - noir",30.0,,,,,,,,,,,,,,,,,,,,,,,,"Outil d'extraction des touches du clavier, 105 dessus de touches",,,Noir,,,,,,,,,,,,,,,,,,,,,,,,,,,,,,,,,,,,,Plastique ABS,,,,,,,,,,,,,,,,,,,,,,,,,,,,,,,,,,,,,,,,,,,,,,,,,,,,,,,,,,,,,,,,,,,,,,,
5733026,StarTech.com WRSTRST Repose-poignets ergonomique en gel pour clavier,STARTECH,"poignets ergonomique en gel pour clavier - Noir - Antidérapant - Pour bureaux, tables, et stations de travail debouts - Repose-poignet pour clavier - noir - pour P/N: LAPTOP-SIT-STAND",19.99,,,,,,,,,,,,,,,,,,,,,,,,,,P/N: LAPTOP-SIT-STAND,Noir,,,,,,,,,,,,,,,,,,,,Garantie de 2 ans,,,,,,,,,,,,,,,,,,,,,,,,,,,,,,,,,,,,404 g,,,,,,,,,,,,,,,,,,,,,,,,,,,,,,,,,,,,,,,,,,,,,,,,,,,,
10311683,XtremeMac,MCL SAMAR,"Tapis de souris - aluminium, rond - argent",24.99,,,,,,,,,,,,,,,,,,,,,,,,,,,Argent,,,,,,,,,,,,,,,,,,,,,,,,,,,,,,,,,,,,,Aluminium,,,,,,,,,,,,,,,,,,,,,,,,,,,,,,,,,,,,,,,,,,,,,,,,,,,,,,,,,,,,,,,,,,,,,,,
11559516,Apple Magic Keyboard,APPLE,Clavier et étui - avec trackpad - Apple Smart connector - QWERTY - Anglais US,290.83,,,,,,Clavier intégré,Trackpad,,,,,,,,,,,,,,,,,,,,,,,,,,,,,,,,,"Volume, luminosité",,,,,,,1 an de garantie,,,,Apple Smart connector,,,,,,,QWERTY Anglais US,,,,,,,,,,,,,,,,,,,,,,,,,,,,,,,"Protection arrière, protection avant",,,,,,,,,,,,,,,,,,,,,,,,,Filaire,,,,,,,,,,,,,,,,,,,,,
8571090,Mobilis C2,MOBILIS,Clavier et étui (étui de protection) - détachable - avec pavé tactile - sans fil - Bluetooth - AZERTY - Français noir étui,89.16,,,,,,Clavier détachable,Pavé tactile,,,,,,,,,,,,,,,,,,,,Noir étui,,,,,,,,,,,,,"Lecture/pause, piste précédente, piste suivante, multimédia, luminosité, copier, coller",,,,,,,Garantie de 2 ans,,,,Bluetooth,,,,,,,AZERTY Français,,,,,,,,,,,,,,,,,,,,,,,,,,,,,,,"Amortisseur de chocs, protection contre les chutes",,,,,,,,,,,,,,,,,,,,,,,,,Sans fil,,,,,,,,,,,,,,,,,,,,,
9916365,Targus - Clavier sans fil 2.4 GHz & Bluetooth® grande taille EcoSmart™  (UK),TARGUS,Targus - Clavier sans fil 2.4 GHz & Bluetooth® grande taille EcoSmart™  (UK),69.99,,,,,,,,,,,,,,Oui,,,,,,,,,,,,,Noir,,,,,,,,,,,,,"Interrupteur marche/arrêt, Pairage",,,,,,,Garantie de 2 ans,,,,"Bluetooth 5.0, 2.4 GHz",,,,,,,QWERTY R.-U.,,,,,,,,,,,,104,,,,,,,,,,,,,600 g,,,,,,Protection antimicrobienne DefenseGuard,,,,,,Récepteur sans fil USB,,,,,,,,,,,,,,,,,,,Sans fil,,,,,,,,,,,,,,,,,,,,,
7426189,"PORT - MANCHESTER II IPAD 10.2"" GEN 7/8/9 & 10.5""",PORT DESIG,MANCHESTER II+KEYBOARD TOUCHPAD FR IPAD 10.2 GEN 7/8/9+ IPAD PRO 10.5,108.33,,,,,,,Pavé tactile,,,,,,,,,,,,,,,,,,,"Apple 10.2-inch iPad (7ème génération, 8ème génération, 9ème génération); 10.5-inch iPad Pro",,,,,,,,,,,,,,,,,,,,,Garantie limitée à vie,,,,Bluetooth,,,,,,,AZERTY Français,,,,Polyuréthane,,,,,,,,,,,,,,,,,,,,,612 g,,,,,,,,,,,,,,,,,,,,,,,,,,,,,,,Sans fil,,,,,,,,Boîte en carton,,,,,,,,,,,,,
11536578,CHERRY KW 7100 MINI BT,CHERRY,Clavier - sans fil - Bluetooth 5.1 - QWERTY - Europe - commutateur : CHERRY SX - vert agave,46.21,,,,,,,,,,,,,,,,,,,,,,,,,,,Vert agave,,,,,,,,,,,,,,,,,,,,,,,,Bluetooth 5.1,,,,,,,QWERTY Europe,,,,,,,,,,,,77,,,1,,,,,,,,,,430 g,,,,,,,,,,,,,,,,,,,,,,,,,,,,,,,Sans fil,,,,,,,,,,,CHERRY SX,,,,,,,,,,
10293252,Logitech Rugged Combo 4,LOGITECH,Clavier et étui - Apple Smart connector - bleu classique - pour Apple 10.9-inch iPad (10ème génération),159.99,,,,,,Clavier intégré,,,,,,,,,,,,,,,,,,,,Apple 10.9-inch iPad (10ème génération),Bleu classique,,,,,,,,,,,,,"Écran d'accueil, luminosité, recherche, Siri, capture d'écran, lecture/pause, piste suivante, piste précédente, verrouillage écran, clavier virtuel, touche secret, volume -, volume +",,,,,,,Garantie de 3 ans,,,,Apple Smart connector,,,,,,,,,,,,,,,,,,,,,,,,,,,,,,,,570 g,,,,,,"Protection contre les chutes, résistant aux taches, résistant aux éclaboussures",,,,,,,,,,,,,,,,,,,,,,,,,,,,,,,,,,,,,,,,,,,,,,
10379485,Apple Magic Keyboard,APPLE,Clavier et étui - avec trackpad - rétroéclairé - Apple Smart connector - QWERTY - US - noir,332.5,,,,,,Clavier intégré,Trackpad,,,,,,,,,,,,,,,,,,,,Noir,,,,,,,,,,,,,"Volume, luminosité",,,,,,,1 an de garantie,,,,Apple Smart connector,,,,,,,QWERTY US,,,,,,,,,,,,,,,,,,,,,,,,,,,,,,,"Protection arrière, protection avant",,,,,,,,,,,,Oui,,,,,,,,,,,,,Filaire,,,,,,,,,,,,,,,,,,,,,
10540482,Apple Magic Keyboard with Touch ID,APPLE,Clavier - USB-C - sans fil - Bluetooth - QWERTY - US,140.83,,,,,,,,,,,,,,,,,,,,,,,,,,,,,,,,,Lecteur d'empreintes digitales,,,,,,,Multimédia,,,,,,,1 an de garantie,,,,Bluetooth,,,,,,,QWERTY US,,,,,,,,,,,,,,,,,,,,,,,,,243 g,,,,,,,,,,,,,,,,,,,,,,,,,,,,,,,Sans fil,,,,,,,,,,,,,,,,,,,,,
5069657,MCL Samar ACK-301W/N,MCL SAMAR,301W/N - Clavier - sans fil - 2.4 GHz - AZERTY - Français - noir,14.2,,,,,,,,,,,,,,Oui,,,,,,,,,,,,,Noir,,,,,,,,,,,,,,,,,,,,,,,,2.4 GHz,,,,,,,AZERTY Français,,,,,,,,,,,,,,,,,,,,,,,,,375 g,,,,,,,,,,,,Nano récepteur sans fil USB,,,,,,,,,,,,,,,,,,,Sans fil,,,,,,,,,,,,,,,,,,,,,
30045881,UNBW,UNBW,UNBW/KBD 125 WD HP,1.0,,,,,,,,,,,,,,,,,,,,,,,,,,,,,,,,,,,,,,,,,,,,,,,,,,,,,,,,,,,,,,,,,,,,,,,,,,,,,,,,,,,,,,,,,,,,,,,,,,,,,,,,,,,,,,,,,,,,,,,,,,,,,,,,,,,,,,,
10309848,Clavier Surface Pro,MICROSOFT,Clavier Surface Pro Keyboard (Clavier seul avec emplacement pour Stylet) - Alcantara - Bleu Saphir,151.8,"13.5"" écran tactile 2256 x 1504",,,,Oui,,,,,,,,,,,,,,,,,,,,,,,,,,,,,,,,,,,,,,,,,,1 an de garantie,,,,,,,,,,,,,,,,,,,,,,,,,,,,,,,,,,,,,,,,,,,,,,,,,,Bluetooth 5.3,,,,,,,SSD,,,,,,,,,,,,,,,,,,,,,,,,,,,,,,Oui,
11841035,HyperX Armada 25,HP INC,"Écran LED - jeux - 25"" (24.5"" visualisable) - 1920 x 1080 Full HD (1080p) @ 240 Hz - IPS - 450 cd/m² - 1000:1 - 1 ms - 2xHDMI, DisplayPort - noir",658.5,,,,,,,,,,,,,Classe E,,,,,,,,,,"2xHDMI, DisplayPort",,,,Noir,,,,,,,,,200 kg d'émissions de carbone,,16:9,,,,,,,,99% sRGB,Garantie de 2 ans,,,,,,,,Oui,,,,,,450 cd/m²,,,,,,,,,,,,,,,,,,,,,,2.9 kg,,,,,,,,,,1000:1,Mat,,"Pivot (rotation), pivotant, inclinaison",,,Full HD (1080p) 1920 x 1080 à 240 Hz,,,,,,,,,,,,NVIDIA G-SYNC,,,,,,,1 ms (gris-à-gris avec overdrive),CA 100-240 V (50/60 Hz),,,,,,,,,,IPS,,,,,,
11536988,CHERRY STREAM PROTECT,CHERRY,Clavier - sans fil - 2.4 GHz - AZERTY - Français - commutateur : CHERRY SX - noir,62.66,,,,,,,,,,,,,,Oui,,,,,,,,,,,,,Noir,,,,,,,,,,,,,"Calculatrice, e-mail, touche secret, navigateur, Verrouiller l'ordinateur, lecture/pause, piste précédente, piste suivante, volume -, volume +",,,,,,,Garantie de 3 ans,,,,2.4 GHz,,,,,,,AZERTY Français,,,,,,,,,,,,105,,,10,,,Blue Angel,,,,,,,1.02 kg,,,,,,"Résistant aux éclaboussures, résistant au désinfectant",,,,,,Nano récepteur sans fil USB,,,,,,,,,,,,,,,,,,,Sans fil,,,,,,,,,,,CHERRY SX,,,,,,,,,,
11521771,Urban Factory Kabee Pro,URBAN-FACT,KABEE PRO: WIRED USB-A KEYBOARD WITH 6 MACRO KEYS AND 19 ANTI-GHOSTING KEYS - WINDOWS,33.25,,,,,,,,,,,,,,Oui,,,,,,,,,,,,,Noir,,,,,,,,,,,,,,,,,,,,Garantie de 2 ans,,,,USB,,,,,,,AZERTY Français,,,,,,,,,,,,115,,,,,,,,,,,,,670 g,,,,,,,,,,,,,,,,,,RGB,,,,,,,,,,,,,Filaire,,,,,,,,,,,,,,,,,,,,,
7413940,Targus,TARGUS,"Clavier - compact, multi-dispositifs, antimicrobien - sans fil - Bluetooth 5.1 - QWERTY - R.-U. - noir - B2B",34.99,,,,,,,,,,,,,,,,,,,,,,,,,,,Noir,,,,,,,,,,,,,Interrupteur marche/arrêt,,,,,,,Garantie de 2 ans,,,,Bluetooth 5.1,,,,,,,QWERTY R.-U.,,,,,,,,,,,,,,,,,,,,,,,,,450 g,,,,,B2B,Antimicrobien,,,,,,,,,,,,,,,,,,,,,,,,,Sans fil,,,,,,,,,,,,,,,,,,,,,
8303166,CHERRY KW 9200 MINI,CHERRY,"Clavier - sans fil - 2.4 GHz, Bluetooth 5.0 - AZERTY - Français - commutateur : CHERRY SX - noir",71.42,,,,,,,,,,,,,,,,,,,,,,,,,,,Noir,,,,,,,,,,,,,"Volume, lecture/pause",,,,,,,Garantie de 3 ans,,,,"2.4 GHz, Bluetooth 5.0",,,,,,,AZERTY Français,,,,,,,,,,,,78,,,,,,,,,,,,,454 g,,,,,,,,,,,,Nano récepteur sans fil USB,,,,,,,,,,,,,,,,,,,"Sans fil, filaire",,,,,,,,,,,CHERRY SX,,,,,,,,,,
10442140,Acer Predator Aethon 301 TKL,ACER,Clavier - rétro-éclairé - commutateur : Gateron Blue - noir - Pour la vente au détail,74.92,,,,,,,,,,,,,,,,,,,,,,,,,,,Noir,,,,,,,,,,,,,,,,,,,,,,,,,,,,,,,,,,,,,,,,,,,,,,,,,,,,,,,,,,,,,,,,,,,,,,,,,,6 zones RGB,,,,,,,,,,,,,Filaire,,,,,,,,Pour la vente au détail,,,Gateron Blue,,,,,,,,,,
6360164,Dell Pro Keyboard and Mouse KM5221W,DELL,Ensemble clavier et souris - sans fil - 2.4 GHz - QWERTY - International US - noir - avec 3 years NBD Advance Exchange,44.5,,,,,,,,,,,,,,,,,,,,,,,,,,,Noir,,,,,Souris - sans fil - optique,,,,,,,,"Volume, touche secret",,,,,,,,,,,2.4 GHz,,,,,,,QWERTY International US,,,,,,,,,,,,,,3,,,,,,,,,,,,,,,,,,,,,,,Récepteur sans fil USB,,,,,,,3 years NBD Advance Exchange,,,,,,,,,,,,Sans fil,,,,,,,,,,,,,,,,,,,,,
9338748,MCL,MCL SAMAR,Clavier - bioplastique - sans fil - 2.4 GHz - AZERTY - Français - beige terrazzo,23.57,,,,,,,,,,,,,,Oui,,,,,,,,,,,,,Beige terrazzo,,,,,,,,,,,,,,,,,,,,,,,,2.4 GHz,,,,,,,AZERTY Français,,,,,,,,,,,,105,,,,,,,,,,,,,,,,,,,,,,,,,Nano récepteur sans fil USB,,,,,,,,,,,,,,,,,,,Sans fil,,,,,,,,,,,,,,,,,,,,,
9338752,MCL,MCL SAMAR,Ensemble clavier et souris - bioplastique - AZERTY - Français - beige terrazzo,22.5,,,,,,,,,,,,,,Oui,,,,,,,,,,,,,Beige terrazzo,,,,,Souris - filaire,,,,,,,,,,,,,,,,,,,,,,,,,,AZERTY Français,,,,,,,,,,,,105,,6,,,,,,,,,,,,,,,,,,,,,,,,,,,,,,,,,,,,,,,,,,Filaire,,,,,,,,,,,,,,,,,,,,,
11509936,CHERRY XTRFY K5V2,CHERRY,Clavier - 65% - compact - rétroéclairage - QWERTY - US - commutateur : CHERRY MX2A Red (échangeable à chaud) - noir,116.81,,,,,,,,,,,,,,,,,,,,,,,,,,,Noir,,,,,,,,,,,,,"Renversement de la clé n, paramètres d'illumination, lecture/pause, volume +, touche secret",,,,,,,Garantie de 2 ans,,,,,,,,Oui,,,QWERTY US,,,,,,,,,,,,,,,,,,,,,,,,,841 g,,,,,,,,,,,,,,,,,,Bande LED RGB,,,,,,,,,,,,,Filaire,,,,,,,,,,,CHERRY MX2A Red (échangeable à chaud),,,,,,,,,,
9538142,Alienware AW420K,DELL,Clavier - sans clé - rétroéclairé - USB - QWERTY - US - commutateur : CHERRY MX Red - lunar light,115.5,,,,,,,,,,,,,,,,,,,,,,,,,,,Lunar light,,,,,,,,,,,,,"Programmable, verrou clavier Windows, renversement de la clé n",,,,,,,Garantie de 2 ans,,,,USB,,,,Oui,,,QWERTY US,,,,,,,,,,,,,,,,,,,,,,,,,787 g,,,,,,,,,,,,,,,,,,"AlienFX RGB / 16,8 millions de couleurs",,,,,,,,,,,,,Filaire,,,,,,,,,,,CHERRY MX Red,,,,,,,,,,
7812629,Alienware AW420K,DELL,Clavier - sans clé - rétroéclairé - USB - commutateur : CHERRY MX Red - Dark Side of the Moon (Noir) - Pour la vente au détail - boîte,94.25,,,,,,,,,,,,,,,,,,,,,,,,,,,Dark Side of the Moon (Noir),,,,,,,,,,,,,Programmable,,,,,,,Garantie de 2 ans,,,,USB,,,,Oui,,,,,,,,,,,,,,,,,,,,,,,,,,,,787 g,,,,,,,,,,,,,,,,,,"AlienFX RGB / 16,8 millions de couleurs",,,,,,,,,,,,,Filaire,,,,,,,,Pour la vente au détail - boîte,,,CHERRY MX Red,,,,,,,,,,
9851926,Alienware Pro Wireless Gaming Keyboard,DELL,"Clavier - 75% - compact TKL - AlienFX RGB par touche / 16,8 millions de couleurs - sans fil - 2.4 GHz, Bluetooth 5.1, USB - QWERTY - US - commutateur : commutateurs mécaniques linéaires Alienware (remplaçables à chaud) - lunar light",181.25,,,,,,,,,,,,,,,,,,,,,,,,,,,Lunar light,,,,,,,,,,,,,"Renversement de la clé n, programmable, verrou clavier Windows",,,,,,,Garantie de 2 ans,,,,"2.4 GHz, Bluetooth 5.1, USB",,,,Oui,,,QWERTY US,,,,,,,,,,,,,,,,,,,,,,,,,819.73 g,,,,,,,,,,,,,,,,,,"AlienFX RGB par touche / 16,8 millions de couleurs",,,,,,,,,,,,,"Filaire, sans fil",,,,,,,,,,,Commutateurs mécaniques linéaires Alienware (remplaçables à chaud),,,,,,,,,,
8428731,Targus - Clavier grande taille Bluetooth® EcoSmart® à énergie solaire (UK),TARGUS,Targus - Clavier grande taille Bluetooth® EcoSmart® à énergie solaire (UK),99.99,,,,,,,,,,,,,,Oui,,,,,,,,,,,,,Noir,,,,,,,,,,,,,,,,,,,,Garantie de 2 ans,,,,Bluetooth 5.0,,,,,,,QWERTY R.-U.,,,,,,,,,,,,,,,,,,,,,,,,,840 g,,,,,,Protection antimicrobienne DefenseGuard,,,,,,,,,,,,3 niveaux,,,,,,,,,,,,,Sans fil,,,,,,,,Emballage durable,,,Commutateurs à clé à ciseaux,,,,,,,,,,
10423721,HP 965,HP INC,"Ensemble clavier et pavé numérique - taille compacte, disposition à 2 zones, pavé numérique séparé, déplacement des touches à profil bas, multi-dispositifs - sans fil - Bluetooth - Français - noir",198.0,,,,,,,,,,,,,,Oui,,,,,,,,,,,,,Noir,,,,,Clavier - sans fil,,,,,,,,"Dictée, commutateur de langue, Copilot",,,,,,,1 an de garantie,,,,Bluetooth,,,,,,,Français,,,,,,,,,,,,,,,,,,,,,,,,,,,,,,,,,,,,,Récepteur sans fil USB,,,,,,,,,,,,,,,,,,,Sans fil,,,,,,,,,,,,,,,,,,,,,
8427325,Samsung Galaxy Tab S10 Ultra / S9 Ultra Coque arrière ultra renforcée avec fonction Stand Noir,SAMSUNG,RX910 - Coque de protection pour tablette - extérieur - titane - pour Galaxy Tab S9 Ultra,89.9,,,,,,,,,,,,,,,,,,,,,,,,,,Galaxy Tab S9 Ultra,Titane,,,,,,,,,,,,,,,,,,,,,,,,,,,,,,,,,,,,,,,,,,,,,,,,,,,,,,,,,,,,,,,,,,,,,,,,,,,,,,,,,,,,,,,,,,,,,,,,,Coque de protection pour tablette,,,,,,,,,,,
8672766,CHERRY KW 7100 MINI BT,CHERRY,Clavier - sans fil - Bluetooth 5.1 - AZERTY - Français - commutateur : CHERRY SX,46.21,,,,,,,,,,,,,,,,,,,,,,,,,,,,,,,,,,,,,,,,,,,,,,,Garantie de 2 ans,,,,Bluetooth 5.1,,,,,,,AZERTY Français,,,,,,,,,,,,,,,,,,,,,,,,,454 g,,,,,,,,,,,,,,,,,,,,,,,,,,,,,,,Sans fil,,,,,,,,,,,CHERRY SX,,,,,,,,,,
7754296,Dell KB500,DELL,Clavier - sans fil - 2.4 GHz - QWERTY - International US - noir - avec 3 years NBD Advance Exchange,34.75,,,,,,,,,,,,,,Oui,,,,,,,,,,,,,Noir,,,,,,,,,,,,,,,,,,,,,,,,2.4 GHz,,,,,,,QWERTY International US,,,,,,,,,,,,,,,,,,,,,,,,,400 g,,,,,,,,,,,,Récepteur sans fil USB,,,,,,,3 years NBD Advance Exchange,,,,,,,,,,,,Sans fil,,,,,,,,,,,,,,,,,,,,,
10423722,HP 485 Comfort,HP INC,"Clavier - multi-appareils, 23 touches programmables, disposition à 3 zones - full size - USB - Français - noir",74.2,,,,,,,,,,,,,,Oui,,,,,,,,,,,,,Noir,,,,,,,,,,,,,"Dictée, Copilot, commutateur de langue, Caps Lock, verrouillage de la clé FN",,,,,,,1 an de garantie,,,,USB,,,,,,,Français,,,,,,,,,,,,,,,,,,,,,,,,,870 g,,,,,,Résistant aux éclaboussures,,,,,,,,,,,,,,,,,,,,,,,,,Filaire,,,,,,,,,,,,,,,,,,,,,
11536783,Active Key AK-7000,CHERRY,7000 - Clavier - PS/2 - US - noir,49.65,,,,,,,,,,,,,,,,,,,,,,,,,,,Noir,,,,,,,,,,,,,,,,,,,,,,,,PS/2,,,,,,,US,,,,,,,,,,,,103,,,,,,,,,,,,,660 g,,,,,,,,,,,,,,,,,,,,,,,,,,,,,,,Filaire,,,,,,,,,,,,,,,,,,,,,
8468951,Dell Pro Premium Collaboration KM900,DELL,"Ensemble clavier et souris - collaboration - rétroéclairé - sans fil - 2.4 GHz, Bluetooth 5.1 - QWERTY - International US - graphite - avec 3 years NBD Advance Exchange",207.5,,,,,,,,,,,,,,Oui,,,,,,,,,,,,,Graphite,,,,,Souris - sans fil,,,,,,,,"Multimédia, programmable, calculatrice, touche secret, lecture/pause, contrôle du rétroéclairage, écran d'impression, verrouillage du défilement",,,,,,,,,,,"2.4 GHz, Bluetooth 5.1",,,,,,,QWERTY International US,,,,,,,,,,,,,,,,,,,,Commutation de la sensibilité en temps réel 200 - 8000 ppp,,,,,,,,,,,,,,,,,Récepteur sans fil USB,,,,,,Oui,3 years NBD Advance Exchange,,,,,,,,,,,,Sans fil,,,,,,,,,,,,,,,,,,,,,
8469476,Dell Pro Premium Collaboration KB900,DELL,"Clavier - collaboration - rétroéclairé - sans fil - 2.4 GHz, Bluetooth 5.1 - AZERTY - Français - graphite - avec 3 years NBD Advance Exchange",126.25,,,,,,,,,,,,,,Oui,,,,,,,,,,,,,Graphite,,,,,,,,,,,,,"Commandes tactiles de zoom, contrôle du rétroéclairage, calculatrice, lecture/pause, écran d'impression, verrouillage du défilement, programmable, multimédia",,,,,,,,,,,"2.4 GHz, Bluetooth 5.1",,,,,,,AZERTY Français,,,,,,,,,,,,,,,,,,,,,,,,,728 g,,,,,,,,,,,,Récepteur sans fil USB,,,,,,Oui,3 years NBD Advance Exchange,,,,,,,,,,,,Sans fil,,,,,,,,,,,,,,,,,,,,,
9916366,Targus - Kit clavier & souris sans fil 2.4 GHz (UK),TARGUS,Targus - Kit clavier & souris sans fil 2.4 GHz (UK),29.99,,,,,,,,,,,,,,Oui,,,,,,,,,,,,,Noir,,,,,Souris - sans fil - optique,,,,,,,,,,,,,,,Garantie de 2 ans,,,,2.4 GHz,,,,,,,QWERTY R.-U.,,,,,,,,,,,,,,,,,,,,,,,,,,,,,,,,,,,,,Récepteur sans fil USB,,,,,,,,,,,,,,,,,,,Sans fil,,,,,,,,,,,,,,,,,,,,,
7449715,Logitech Signature MK650 Combo for Business,LOGITECH,Ensemble clavier et souris - sans fil - Bluetooth LE - QWERTY - Tchèque/Slovaque - graphite,84.99,,,,,,,,,,,,,,Oui,,,,,,,,,,,,,Graphite,,,,,Souris - sans fil,,,,,,,,"Dictée, Emoji, écran de découpage, coupure du microphone, fonction arrière, actualisation, Tab, imprimé, calculatrice, commutateur de langue",,,,,,,Garantie de 2 ans,,,,Bluetooth LE,,,,,,,QWERTY Tchèque/Slovaque,,,,,,,,,,,,,,5,6,,,,,Commutation de sensibilité en temps réel 400 - 4 000 dpi,,,,,,,,,,,,,,,,,Récepteur USB Logitech Logi Bolt,,,,,,,,,,,,,,,,,,,Sans fil,,,,,,,,,,,,,,,,,,,,,
10382922,KM270 EQ Kit clavier + souris sans fil rechargeable,KENSINGTON,"Kensington KM270 EQ - Ensemble clavier et souris - rechargeable - full size - sans fil - 2.4 GHz, Bluetooth - AZERTY - Français",45.83,,,,,,,,,,,,,,Oui,,,,,,,,,,,,,,,,,,Souris - sans fil,,,,,,,,,,,,,,,Garantie de 3 ans,,,,"2.4 GHz, Bluetooth",,,,,,,AZERTY Français,,,,,,,,,,,,,,3,105,,,,,,,,,,,,,,,,Anti-déversement,,,,,,Récepteur sans fil USB,,,,,,,,,,,,,,,,,,,Sans fil,,,,,,,,,,,,,,,,,,,,,
5434122,Alienware AW510K,DELL,"Clavier - rétroéclairé - USB - commutateur : CHERRY MX Low Profile Red - lunar light - pour Alienware Area-51, Aurora, Aurora R10, Aurora R9, M15, M17; G5 5090; XPS 8940",132.0,,,,,,,,,,,,,,Oui,,,,,,,,,,,,"Alienware Area-51, Aurora, Aurora R10, Aurora R9, M15, M17; G5 5090; XPS 8940",Lunar light,,,,,,,,,,,,,"Touche secret, lecture/pause, stop, arrière, volume -, volume +, saut vers l'arrière, saut vers l'avant",,,,,,,Garantie de 2 ans,,,,USB,,,,,,,,,,,,,,,,,,,,,,,,,,,,,,,,910 g,,,,,,,,,,,,,,,,,,"RGB / 16,8 millions de couleurs",,,,,,,,,,,,,Filaire,,,,,,,,,,,CHERRY MX Low Profile Red,,,,,,,,,,
10540487,Apple Magic Keyboard with Touch ID and Numeric Keypad,APPLE,Clavier - USB-C - sans fil - Bluetooth - QWERTY - Anglais US - clés noires,190.83,,,,,,,,,,,,,,Oui,,,,,,,,,,,,,Clés noires,,,,,,Lecteur d'empreintes digitales,,,,,,,Multimédia,,,,,,,1 an de garantie,,,,Bluetooth,,,,,,,QWERTY Anglais US,,,,,,,,,,,,,,,,,,,,,,,,,369 g,,,,,,,,,,,,,,,,,,,,,,,,,,,,,,,Sans fil,,,,,,,,,,,,,,,,,,,,,
7841383,HP Dual Mode 975,HP INC,Clavier - rétroéclairé - sans fil - Bluetooth - Français,164.0,,,,,,,,,,,,,,Oui,,,,,,,,,,,,,,,,,,,,,,,,,,,,,,,,,1 an de garantie,,,,Bluetooth,,,,,,,Français,,,,,,,,,,,,,,,,,,,,,,,,,649 g,,,,,,,,,,,,Nano récepteur sans fil USB,,,,,,Oui,,,,,,,,,,,,,Sans fil,,,,,,,,,,,,,,,,,,,,,
5696959,Apple Smart,APPLE,Smart Keyboard Folio pour iPad Pro 11 pouces (2I génération) - Anglais américain,165.83,,,,,,,,,,,,,,,,,,,,,,,,,,"10.9-inch iPad Air (4ème génération, 5ème génération); 11-inch iPad Pro (1ère génération, 2e génération, 3ème génération, 4ème génération)",,,,,,,,,,,,,,,,,,,,,,,,,Apple Smart connector,,,,,,,US,,,,,,,,,,,,,,,,,,,,,,,,,,,,,,,,,,,,,,,,,,,,,,,,,,,,,,,,Filaire,,,,,,,,,,,,,,,,,,,,,
7319920,SATECHI CLAVIER BT Alu AZERTY USB-C,SATECHI,Clavier - rétroéclairé - sans fil - Bluetooth - AZERTY - Français,74.99,,,,,,,,,,,,,,Oui,,,,,,,,,,,,,,,,,,,,,,,,,,"Changement d'application, recherche, touche secret, luminosité, lecture/pause, piste précédente, piste suivante, contrôle du rétroéclairage, volume -, volume +, verrouillage de la clé FN, bluetooth, éjection",,,,,,,1 an de garantie,,,,Bluetooth,,,,,,,AZERTY Français,,,,,,,,,,,,,,,,,,,,,,,,,440 g,,,,,,,,,,,,,,,,,,Oui,,,,,,,,,,,,,Sans fil,,,,,,,,,,,,,,,,,,,,,
6308423,PORT - Repose-poignets ergonomique pour clavier,PORT DESIG,Tapis ergonomique pour clavierUn accoudoir confortable pour une utilisation plus durableCoussin en gel pour un soutien optimal sans douleur ni pressionCouverture en lycra souple pour un toucher confortableBase antidérapante à haute adhérence pour un p,15.83,,,,,,,,,,,,,,,,,,,,,,,,,,,,,,,,,,,,,,,,,,,,,,,Garantie de 2 ans,,,,,,,,,,,,,,,,,"Caoutchouc, gel, polyester",,,,,,,,,,,,,,,,,,,300 g,,,,,,,,,,,,,,,,,,,,,,,,,,,,,,,,,,,,,,,,,,,,,,,,,,,,
10388161,Mobilis RESIST Pack,MOBILIS,Coque de protection pour tablette - robuste - TFP 4.0 - noir - pour Samsung Galaxy Tab A9,100.83,,,,,,,,,,,,,,,,,,,,,,,,,,Samsung Galaxy Tab A9,Noir,,,,,,,,,,,,,,,,,,,,Garantie de 2 ans,,,,,,,,,,,,,,,,TFP 4.0,,,,,,,,,,,,,,,,,,,,,,,,,,,,,,,,,,,,,,,,,,,,,,,,,,,,,,,,,,,,,Coque de protection pour tablette,,,,,,,,,,,
5661977,StarTech.com 4POSTRACK15U Rack serveur réglable à cadre ouvert 15U,STARTECH,"4 montants - 55,9 cm à 101,5 cm - Rack cadre ouvert - 4 montants - sur le sol - noir - 15U",256.99,,,,,,,,,,"Système de gestion de câbles intégré, rails de montage ajustables",,,,,,,,,,,,,,"4 x roulettes, 18 écrous à bride M6, 18 rondelles plates M6, 18 vis hexagonales M6, 8 crochets de gestion de câbles, 8 vis de montage pour crochet, 2 rails verticaux gauches, 2 rails verticaux droits, 8 sections de coin, 8 sections centrales, 2 supports supérieurs, 50 rondelles plates M8, 50 vis hexagonales M8, clé M6 (10 mm), clé M8 (13 mm), tournevis Phillips, 4 vis à tête Phillips, 4 rondelles de blocage, 24 vis M6, 24 rondelles plastiques M6, 24 écrous à cage M6, 4 pieds de nivellement, 4 câbles de mise à la terre",,,Noir,,,,,,,,,,,,,,,,,,,,Garantie de 2 ans,15U,,,,,,,,,,,,,,,,Acier,,,,,,,,,,,,,,,,,,,24.7 kg,,Sur le sol,,,,,,,,,,,,,,,,,,,,,,,,,,,,,,,,,,,,,,,,,,,,,,Cadre ouvert - 4 montants,,,,
11841014,HP,HP INC,"Microphone - USB, prise jack de 3,5 mm - blanc - pour Victus by HP Laptop 15, 16; Laptop 14, 15, 17; Pavilion x360 Laptop; Pro 290 G9",216.0,,,,,,,,,,,,,,,,"Mac, Windows",,,,,,,,,,"Victus by HP Laptop 15, 16; HP 250 G9; Elite 800 G9; EliteDesk 800 G6; EliteOne 870 G9; Laptop 14, 15, 15s, 17; Pavilion Plus Laptop 14; Pavilion x360 Laptop; Pro 290 G9",Blanc,,,,,,,,,,,,,,,,Éclairage RVB,,,,,,,,,,,,,,,,,,,,,,,,"Bidirectionnel, stéréo, cardioïde, omni-directionnel",,,,,,,,,,,,,,,,,,,,,,,,,,,,,,,,,,,,,,,,,,,,,,,,,Condensateur électret,,,,,,,,"Microphone - USB, prise jack de 3,5 mm",,,,Dessus de table,,,,,"Console de jeux, ordinateur",,
11536462,CHERRY XTRFY MX 3.1,CHERRY,Clavier - 100% - full size - rétroéclairé - USB-C - Français - commutateur : CHERRY MX2A Red - blanc,116.81,,,,,,,,,,,,,,Oui,,,,,,,,,,,,,Blanc,,,,,,,,,,,,,Verrou clavier Windows,,,,,,,,,,,USB-C,,,,Oui,,,Français,,,,,,,,,,,,,,,,,,,,,,,,,1.12 kg,,,,,,Résistant à l'abrasion,,,,,,,,,,,,"RGB / 16,8 millions de couleurs",,,,,,,,,,,,,Filaire,,,,,,,,,,,CHERRY MX2A Red,,,,,,,,,,
11536463,CHERRY XTRFY MX 3.1,CHERRY,Clavier - 100% - full size - rétroéclairé - USB-C - Français - commutateur : CHERRY MX2A Red - noir,116.81,,,,,,,,,,,,,,Oui,,,,,,,,,,,,,Noir,,,,,,,,,,,,,Verrou clavier Windows,,,,,,,,,,,USB-C,,,,Oui,,,Français,,,,,,,,,,,,,,,,,,,,,,,,,1.12 kg,,,,,,Résistant à l'abrasion,,,,,,,,,,,,"RGB / 16,8 millions de couleurs",,,,,,,,,,,,,Filaire,,,,,,,,,,,CHERRY MX2A Red,,,,,,,,,,
3465877,CHERRY G84-5200 XS Complete Keyboard,CHERRY,"5200 XS Complete Keyboard - Clavier - PS/2, USB - QWERTY - US - noir",84.03,,,,,,,,,,,Compatible with Windows 7,,,,,,,,,,,,,,,,Noir,,,,,,,,,,,,,,,Technologie Cherry ML,,,,,Garantie de 3 ans,,,,"PS/2, USB",,,,,,,QWERTY US,,,,,,,,,,,,103,,,,,,,,,,,,,0.55 kg,,,,,,,,,,,,,,,,,,,,,,,,,,,,,,,Filaire,,,,,,,,,,,,,,,,,,,,,
10455534,Dell Pro Compact Silent Keyboard and Mouse,DELL,"KM555 - Ensemble clavier et souris - sans fil - 2.4 GHz, Bluetooth 5.1 - QWERTY - International US - noir - avec 3 years NBD Advance Exchange",50.5,,,,,,,,,,,,,,Oui,,,,,,,,,,,,,Noir,,,,,Souris - sans fil - optique - droitiers et gauchers,,,,,,,,"Copilot, 18 touches de raccourci programmables, touche secret, volume +, volume -, lecture/pause, avant, arrière",,,,,,,,,,,"2.4 GHz, Bluetooth 5.1",,,,,,,QWERTY International US,,,,,,,,,,,,,,3,,,,,,,,,,,,,,,,,Résistant aux éclaboussures,,,,,,Récepteur sans fil USB,,,,,,,3 years NBD Advance Exchange,,,,,,,,,,,,Sans fil,,,,,,,,,,,,,,,,,,,,,
