2656309,Urban Keyboard Sleeve,URBAN-FACT,"Clavier et étui - sans fil - Bluetooth - noir clavier, noir étui",49.92,,,,,,,,,,,,,,,,,,,,,,,,,,,"Noir clavier, noir étui",,,,,,,,,,,,,,,,,,,,Garantie de 2 ans,,,,Bluetooth,,,,,,,,,,,Cuir,,,,,,,,,,,,,,,,,,,,,319 g,,,,,,,,,,,,,,,,,,,,,,,,,,,,,,,Sans fil,,,,,,,,,,,,,,,,,,,,,
10311731,XtremeMac,MCL SAMAR,"Clavier - universel, multi-appareil - sans fil - Bluetooth 3.0 - AZERTY - Français - Pour la vente au détail - boîte",58.33,,,,,,,,,,,,,,Oui,,,,,,,,,,,,,,,,,,,,,,,,,,,,,,,,,,,,,Bluetooth 3.0,,,,,,,AZERTY Français,,,,,,,,,,,,,,,,,,,,,,,,,,,,,,,,,,,,,,,,,,,,,,,,,,,,,,,,Sans fil,,,,,,,,Pour la vente au détail - boîte,,,,,,,,,,,,,
10311686,XtremeMac,MCL SAMAR,Clavier - USB-C - AZERTY - Français,41.66,,,,,,,,,,,,,,Oui,,,,,,,,,,,,,,,,,,,,,,,,,,,,,,,,,,,,,USB-C,,,,,,,AZERTY Français,,,,,,,,,,,,,,,,,,,,,,,,,,,,,,,,,,,,,,,,,,,,,,,,,,,,,,,,Filaire,,,,,,,,,,,,,,,,,,,,,
11536647,CHERRY XTRFY MX 3.1,CHERRY,Clavier - 100% - full size - rétroéclairé - USB-C - Français - commutateur : CHERRY MX2A Brown - noir,116.81,,,,,,,,,,,,,,Oui,,,,,,,,,,,,,Noir,,,,,,,,,,,,,Verrou clavier Windows,,,,,,,,,,,USB-C,,,,Oui,,,Français,,,,,,,,,,,,,,,,,,,,,,,,,1.12 kg,,,,,,Résistant à l'abrasion,,,,,,,,,,,,"RGB / 16,8 millions de couleurs",,,,,,,,,,,,,Filaire,,,,,,,,,,,CHERRY MX2A Brown,,,,,,,,,,
11536460,CHERRY KW 7100 Mini,CHERRY,Clavier - pour MAC - 75% - compact - sans fil - Bluetooth 5.1 - AZERTY - Français - commutateur : CHERRY SX - blanc clair de lune - emballage sans plastique,50.41,,,,,,,,,,,,,,,,,,,,,,,,,,,Blanc clair de lune,,,,,,,,,,,,,"Verrouillage de la clé FN, canal",,,,,,,Garantie de 2 ans,,,,Bluetooth 5.1,,,,,,,AZERTY Français,,,,,,,,,,,,78,,,1,,,,,,,,,,430 g,,,,,,,,,,,,,,,,,,,,,,,,,,,,,,,Sans fil,,,,,,,,Emballage sans plastique,,,CHERRY SX,,,,,,,,,,
9788013,CHERRY KC 200 MX,CHERRY,"Clavier - USB - AZERTY - Français - commutateur : CHERRY MX2A Brown - noir, bronze",75.62,,,,,,,,,,,,,,Oui,,,,,,,,,,,,,"Noir, bronze",,,,,,,,,,,,,"Volume, calculatrice",,,,,,,Garantie de 2 ans,,,,USB,,,,,,,AZERTY Français,,,,,,,,,,,,,,,,,,,,,,,,,830 g,,,,,,,,,,,,,,,,,,,,,,,,,,,,,,,Filaire,,,,,,,,,,,CHERRY MX2A Brown,,,,,,,,,,
5720428,Surface Type Cover DEMO,MICROSOFT,Go Type Cover N COMM Demo SC French Belgium/France Hdwr Commercial Black Demo,41.48,,,,,,,"Trackpad, accéléromètre",,,,,,,,,,,,,,,,,,,Surface Go,Noir,,,,,,,,,,,,,"Multimédia, luminosité, raccourcis Windows",,,,,,,,,,,,,,,,,,Français,,,,,,,,,,,,,,,,,,,,,,,,,245 g,,,,,,,,,,,,,,,,,,Oui,,,,,,,,,,,,,,,,,,,,,,,,,,,,,,,"Démo, commercial",,,
10430297,MCL,MCL SAMAR,Ensemble clavier et souris - bioplastique - sans fil - 2.4 GHz - AZERTY - Français - beige terrazzo - Pour la vente au détail - boîte de couleur,35.8,,,,,,,,,,,,,,Oui,,,,,,,,,,,,,Beige terrazzo,,,,,Souris - sans fil - optique,,,,,,,,,,,,,,,,,,,2.4 GHz,,,,,,,AZERTY Français,,,,,,,,,,,,105,,6,,,,,,,,,,,,,,,,,,,,,,,Nano récepteur sans fil USB,,,,,,,,,,,,,,,,,,,Sans fil,,,,,,,,Pour la vente au détail - boîte de couleur,,,,,,,,,,,,,
3738256,BLACK USB DIGITAL PAVE,UNIFORMATI,Uniformatic - Pavé numérique - USB - noir,15.97,,,,,,,,,,,,,,,,,,,,,,,,,,,Noir,,,,,,,,,,,,,,,,,,,,,,,,USB,,,,,,,,,,,,,,,,,,,19,,,,,,,,,,,,,,,,,,,,,,,,,,,,,,,,,,,,,,,,,,,,Filaire,,,,,,,,,,,,,,,,,,,,,
11509868,CHERRY XTRFY K4V2,CHERRY,Clavier - RGB - 80% - TKL - backlit - USB - AZERTY - Français - commutateur : CHERRY MX2A Red - blanc,100.0,,,,,,,,,,,,,,,,,,,,,,,,,,,Blanc,,,,,,,,,,,,,"Renversement de la clé n, mode de touche de jeu, contrôle des médias, verrouillage de la clé FN, piste suivante, lecture/pause, touche secret, volume +, volume -",,,,,,,Garantie de 2 ans,,,,USB,,,,Oui,,,AZERTY Français,,,,,,,,,,,,,,,,,,,,,,,,,1.05 kg,,,,,,,,,,,,,,,,,,RGB,,,,,,,,,,,,,Filaire,,,,,,,,,,,CHERRY MX2A Red,,,,,,,,,,
2192331,Urban Keyboard Sleeve,URBAN-FACT,"Clavier et étui - sans fil - Bluetooth - AZERTY - blanc clavier, blanc étui",66.81,,,,,,,,,,,,,,,,,,,,,,,,,,,"Blanc clavier, blanc étui",,,,,,,,,,,,,,,"Traitement antibactérien, support de tablette intégré",,,,,,,,,Bluetooth,,,,,,,AZERTY,,,,Cuir,,,,,,,,,,,,,,,,,,,,,0.55 kg,,,,,,,,,,,,,,,,,,,,,,,,,,,,,,,Sans fil,,,,,,,,,,,,,,,,,,,,,
11882435,CHERRY KW 300 MX,CHERRY,"Clavier - 75% - compact - rétro-éclairé - sans fil - Bluetooth 5.2, USB-C - AZERTY - Français - commutateur : CHERRY MX2A Silent Red - noir",91.6,,,,,,,,,,,,,,,,,,,,,,,,,,,Noir,,,,,,,,,,,,,,,,,,,,Garantie de 2 ans,,,,"Bluetooth 5.2, USB-C",,,,,,,AZERTY Français,,,,,,,,,,,,,,,,,,,,,,,,,747 g,,,,,,,,,,,,,,,,,,Blanc,,,,,,,,,,,,,"Sans fil, filaire",,,,,,,,,,,CHERRY MX2A Silent Red,,,,,,,,,,
7896149,ASUS U2000,ASUSTEK,Ensemble clavier et souris - USB - noir,20.83,,,,,,,,,,,,,,Oui,,,,,,,,,,,,,Noir,,,,,Souris - optique,,,,,,,,"Veille, volume",,,,,,,,,,,USB,,,,,,,,,,,,,,,,,,,,,,,,,,,,,,,,,,,,,,,,,,,,,,,,,,,,,,,,,,,,,,,Filaire,,,,,,,,,,,,,,,,,,,,,
2369610,CHERRY TouchBoard G80-11900,CHERRY,11900 - Clavier - USB - Français - noir,158.82,,,,,,,,,,,Works with Windows Vista,,,,,,,,,,,,,,,,Noir,,,,,,,,,,,,,Programmable,,"Technologie Cherry MX, pavé tactile intégré",,,,,Garantie de 3 ans,,,,USB,,,,,,,Français,,,,,,,,,,,,,,,,,,,,,,,,,1.1 kg,,,,,,,,,,,,,,,,,,,,,,,,,,,,,,,Filaire,,,,,,,,,,,,,,,,,,,,,
10390832,Logitech Keys-To-Go 2 for iPad,LOGITECH,To-Go 2 for iPad - Clavier - couvercle intégré - sans fil - Bluetooth LE - AZERTY - Français - gris pâle,89.99,,,,,,,,,,,,,,,,,,,,,,,,,,,Gris pâle,,,,,,,,,,,,,"Easy-Switch, volume, contrôle des médias, luminosité, Emoji, Mission Control, capture d'écran, verrouillage écran, verrouillage de la clé FN",,,,,,,Garantie de 2 ans,,,,Bluetooth LE,,,,,,,AZERTY Français,,,,,,,,,,,,,,,,,,,,,,,,,222 g,,,,,,,,,,,,,,,,,,,,,,,,,,,,,,,Sans fil,,,,,,,,,,,,,,,,,,,,,
4444910,MCL - Mini clavier USB Azerty - Noir,MCL SAMAR,600U/N - Clavier - USB - AZERTY - noir,7.93,,,,,,,,,,,,,,,,,,,,,,,,,,,Noir,,,,,,,,,,,,,,,,,,,,,,,,USB,,,,,,,AZERTY,,,,,,,,,,,,78,,,,,,,,,,,,,260 g,,,,,,,,,,,,,,,,,,,,,,,,,,,,,,,Filaire,,,,,,,,,,,,,,,,,,,,,
11536383,CHERRY STREAM CLAVIER,CHERRY,Clavier - clavier hygiénique désinfectable - lavable - USB - AZERTY - Français - gris perle,51.07,,,,,,,,,,,,,,Oui,,,,,,,,,,,,,Gris perle,,,,,,,,,,,,,"Navigateur, calculatrice, e-mail, touche secret, piste suivante, verrouillage du PC, lecture/pause, piste précédente, volume -, volume +",,,,,,,,,,,USB,,,,,Oui,,AZERTY Français,,,,,,,,,,,,105,,,10,,,Blue Angel,,,,,,,1.01 kg,,,,,,Résistant aux éclaboussures,,,,,,,,,,,,,,,,,,,,,,,,,Filaire,,,,,,,,,,,,,,,,,,,,,
6983088,CHERRY STREAM CLAVIER SANS FIL,CHERRY,Clavier - sans fil - 2.4 GHz - Français - commutateur : CHERRY SX - noir,42.01,,,,,,,,,,,,,,Oui,,,,,,,,,,,,,Noir,,,,,,,,,,,,,"Volume -, volume, volume +, piste précédente, lecture/pause, piste suivante, Verrouiller l'ordinateur, navigateur, e-mail, calculatrice",,,,,,,Garantie de 3 ans,,,,2.4 GHz,,,,,,,Français,,,,,,,,,,,,105,,,10,,,Blue Angel,,,,,,,920 g,,,,,,,,,,,,Nano récepteur sans fil USB,,,,,,,,,,,,,,,,,,,Sans fil,,,,,,,,,,,CHERRY SX,,,,,,,,,,
10427464,Logitech G915 X,LOGITECH,Clavier - backlit - USB - AZERTY - Français - commutateur : GL Tactile - noir,199.99,,,,,,,,,,,,,,Oui,,,,,,,,,,,,,Noir,,,,,,,,,,,,,"Programmable, 9 touches G dédiées, multimédia, bouton du rouleau de volume",,,,,,,Garantie de 2 ans,,,,USB,,,,Oui,,,AZERTY Français,,,,,,,,,,,,,,,,,,,,,,,,,1.04 kg,,,,,,,,,,,,,,,,,,LIGHTSYNC,,,,,,,,,,,,,Filaire,,,,,,,,,,,GL Tactile,,,,,,,,,,
11536740,CHERRY Compact-Keyboard G84-4100,CHERRY,"Keyboard G84-4100 - Clavier - PS/2, USB - Français - gris clair",67.21,,,,,,,,,,,Compatible with Windows 7,,,,,,,,,,,,,,,,Gris clair,,,,,,,,,,,,,,,,,,,,Garantie de 3 ans,,,,"PS/2, USB",,,,,,,Français,,,,,,,,,,,,83,,,,,,,,,,,,,400 g,,,,,,,,,,,,,,,,,,,,,,,,,,,,,,,Filaire,,,,,,,,,,,,,,,,,,,,,
8395669,CHERRY MX 2.0S,CHERRY,Clavier - backlit - USB - AZERTY - Français - commutateur : CHERRY MX Red - noir,92.43,,,,,,,,,,,,,,Oui,,,,,,,,,,,,,Noir,,,,,,,,,,,,,"Verrouillage de la clé FN, navigateur, lecture/pause, calculatrice, touche secret, piste suivante, piste précédente, volume -, volume +, Blocage de la clé WIN",,,,,,,Garantie de 2 ans,,,,USB,,,,Oui,,,AZERTY Français,,,,,,,,,,,,,,,,,,,,,,,,,785 g,,,,,,Résistant à l'abrasion,,,,,,,,,,,,RGB,,,,,,,,,,,,,Filaire,,,,,,,,,,,CHERRY MX Red,,,,,,,,,,
10283833,Philips 2000 series SPT6207B,PHILIPSMMD,Ensemble clavier et souris - USB,15.6,,,,,,,,,,,,,,Oui,,,,,,,,,,,,,,,,,,Souris - filaire - optique - droitiers et gauchers,,,,,,,,"Lecteur multimédia, volume -, volume +, touche secret, piste précédente, piste suivante, lecture/pause, stop, page d'accueil, e-mail, poste de travail, favoris, retour, recherche, actualisation, calculatrice, verrouillage écran",,,,,,,,,,,USB,,,,,,,,,,,,,,,,,,,110,,3,,,,,,3 millions de clics,,,,,,,,,,,,,,,,,,,,,,,,,,,,,,,,,,,,Filaire,,,,,,,,,,,,,,,,,,,,,
1394118,CHERRY Compact-Keyboard G84-4100,CHERRY,"Keyboard G84-4100 - Clavier - PS/2, USB - Français - noir",67.21,,,,,,,,,,,Compatible with Windows 7,,,,,,,,,,,,,,,,Noir,,,,,,,,,,,,,,,Technologie Cherry ML,,,,,Garantie de 3 ans,,,,"PS/2, USB",,,,,,,Français,,,,,,,,,,,,86,,,,,,,,,,,,,400 g,,,,,,,,,,,,,,,,,,,,,,,,,,,,,,,Filaire,,,,,,,,,,,,,,,,,,,,,
3682261,STANDARD KEYBOARD BLACK WRIST REST,UNIFORMATI,Uniformatic - Clavier - USB - Français - noir,17.59,,,,,,,,,,,,,,Oui,,,,,,,,,,,,,Noir,,,,,,,,,,,,,,,,,,,,,,,,USB,,,,,,,Français,,,,,,,,,,,,,,,,,,,,,,,,,,,,,,,,,,,,,,,,,,,,,,,,,,,,,,,,Filaire,,,,,,,,,,,,,,,,,,,,,
10311687,XtremeMac X-Wall,MCL SAMAR,"Wall - Adaptateur secteur - 36 Watt - QC, PD - 2 connecteurs de sortie (24 pin USB-C, USB)",49.97,,,,36 Watt,,,,,,,,,,,,,,,,,,,,,100 % - Plastique recyclé,"Téléphone cellulaire, tablette",,,,,,,,,,,,,,,,,,,,,,,,,,,,,,,,,,,,,,,,PD (USB-C) - 38 W ¦ Charge Rapide (Type-A) - 18 W,,,,,,,,,,,,,,,,,,,,,,,,,,,,,,,,,,,,,,,,,,,,,,,"Qualcomm Quick Charge, Power Delivery",,,,,,,CA 100-240 V (50/60 Hz),,,,Adaptateur secteur,,,,,,"Total 2: 24 pin USB-C, USB",,,,,
2831964,CHERRY XS Complete G84-5200,CHERRY,"5200 - Clavier - PS/2, USB - Français - commutateur : CHERRY ML - noir",84.03,,,,,,,,,,,Compatible with Windows 7,,,,,,,,,,,,,,,,Noir,,,,,,,,,,,,,,,,,,,,Garantie de 3 ans,,,,"PS/2, USB",,,,,,,Français,,,,,,,,,,,,104,,,,,,,,,,,,,0.55 kg,,,,,,,,,,,,,,,,,,,,,,,,,,,,,,,Filaire,,,,,,,,,,,CHERRY ML,,,,,,,,,,
5717165,Microsoft Surface Go Type Cover,MICROSOFT,"Clavier - avec trackpad, accéléromètre - rétroéclairé - Anglais - charbon de bois léger - commercial - pour Surface Go, Go 2",108.01,,,,,,,"Trackpad, accéléromètre",,,,,,,,,,,,,,,,,,,"Surface Go, Go 2",Charbon de bois léger,,,,,,,,,,,,,"Multimédia, luminosité, raccourcis Windows",,,,,,,1 an de garantie,,,,,,,,,,,Anglais,,,,,,,,,,,,,,,,,,,,,,,,,245 g,,,,,,,,,,,,,,,,,,Oui,,,,,,,,,,,,,,,,,,,,,,,,,,,,,,,Commercial,,,
6301216,Ordissimo - clavier pour tablette Celia,ORDISSIMO,"Ordissimo - Clavier tablette Celia  Clavier type folio avec coque de protection "" Clavier simplifié Ordissimo "" Position stand "" Design fin et élégant "" 255 mm x 178 mm x 18 mm (LxPxH) "" Poids 495 g "" Compatible avec tablette Ordissimo Celia",69.0,,,,,,,Pavé tactile,,,,,,,,,,,,,,,,,,,P/N: ART0418,,,,,,,,,,,,,,Multimédia,,,,,,,Garantie de 2 ans,,,,,,,,,,,,,,,,,,,,,,,,,,,,,,,,,,,,495 g,,,,,,"Résistant aux rayures, résistant aux impacts",,,,,,,,,,,,,,,,,,,,,,,,,,,,,,,,,,,,,,,,,,,,,,
11536558,CHERRY STREAM CLAVIER,CHERRY,Clavier - USB - Français - commutateur : CHERRY SX - noir,51.07,,,,,,,,,,,,,,Oui,,,,,,,,,,,,,Noir,,,,,,,,,,,,,"Calculatrice, e-mail, touche secret, navigateur, Verrouiller l'ordinateur, lecture/pause, piste précédente, piste suivante, volume -, volume +",,,,,,,Garantie de 3 ans,,,,USB,,,,,,,Français,,,,,,,,,,,,105,,,10,,,,,,,,,,910 g,,,,,,"Résistant aux éclaboussures, résistant à l'abrasion",,,,,,,,,,,,,,,,,,,,,,,,,Filaire,,,,,,,,,,,CHERRY SX,,,,,,,,,,
3359431,Cherry / Clavier KC 1000 SC avec lecteur de carte à puce intégré USB noir,CHERRY,Clavier KC 1000 SC 105 touches avec lecteur de carte à puce intégré USB noir,40.97,,,,,,,,,,,,,,,,,,,,,,,,,,,Noir,,,,,,,,,,,,,,,"Lecteur intégré de cartes intelligentes, technologie Cherry LPK, forme plate, mode d'entrée PIN",,,,,Garantie de 2 ans,,,,USB,,,,,,,Français,,,,,,,,,,,,105,,,4,,,,,,,,,,840 g,,,,,,,,,,,,,,,,,,,,,,,,,,,,,,,Filaire,,,,,,,,,,,,,,,,,,,,,
8438061,EXTENSION DE CLAVIER SANS FIL ARGENT,SATECHI,Pavé numérique - sans fil - Bluetooth - argent,41.66,,,,,,,,,,,,,,Oui,,,,,,,,,,,,,Argent,,,,,,,,,,,,,,,,,,,,1 an de garantie,,,,Bluetooth,,,,,,,,,,,,,,,,,,,,,,,,,,,,,,,,125 g,,,,,,,,,,,,,,,,,,,,,,,,,,,,,,,Sans fil,,,,,,,,,,,,,,,,,,,,,
11819853,ASUS W5000,ASUSTEK,Ensemble clavier et souris - 100% - sans fil - 2.4 GHz - QWERTY - Espagnol - blanc,45.83,,,,,,,,,,,,,,Oui,,,,,,,,,,,,,Blanc,,,,,Souris - sans fil - optique,,,,,,,,Multimédia,,,,,,,,,,,2.4 GHz,,,,,,,QWERTY Espagnol,,,,,,,,,,,,,,,,,,,,Commutation de sensibilité en temps réel 800/1200/1600 ppp,,,,,,,,,,,,,,,,,Récepteur sans fil USB,,,,,,,,,,,,,,,,,,,Sans fil,,,,,,,,,,,,,,,,,,,,,
11536648,CHERRY Keypad G84-4700,CHERRY,4700 - Pavé numérique - USB - Français - gris clair,50.41,,,,,,,,,,,,,,,,,,,,,,,,,,,Gris clair,,,,,,,,,,,,,Programmable,,Technologie Cherry ML,,,,,Garantie de 3 ans,,,,USB,,,,,,,Français,,,,,,,,,,,,21,,,,,,,,,,,,,0.2 kg,,,,,,,,,,,,,,,,,,,,,,,,,,,,,,,Filaire,,,,,,,,,,,,,,,,,,,,,
11536741,CHERRY XTRFY MX 8.2,CHERRY,"Clavier - 80% - TKL - rétroéclairé - sans fil - Bluetooth 5.2, 2.4 GHz, USB-C - AZERTY - Français - commutateur : CHERRY MX2A Red - noir",167.23,,,,,,,,,,,,,,,,,,,,,,,,,,,Noir,,,,,,,,,,,,,"Navigateur, Touche CHERRY, verrouillage de la clé FN, touche mode jeu, touche secret, volume -, volume +, Blocage de la clé WIN",,,,,,,Garantie de 2 ans,,,,"Bluetooth 5.2, 2.4 GHz, USB-C",,,,Oui,,,AZERTY Français,,,,,,,,,,,,,,,,,,,,,,,,,830 g,,,,,,Résistant à l'abrasion,,,,,,Nano récepteur sans fil USB,,,,,,RGB / 16 millions de couleurs,,,,,,,,,,,,,"Filaire, sans fil",,,,,,,,,,,CHERRY MX2A Red,,,,,,,,,,
11536990,CHERRY XTRFY MX 2.0S,CHERRY,Clavier - 100% - full size - rétroéclairé - USB - AZERTY - Français - commutateur : CHERRY MX2A Red - noir,91.6,,,,,,,,,,,,,,Oui,,,,,,,,,,,,,Noir,,,,,,,,,,,,,"Navigateur, Touche CHERRY, calculatrice, verrouillage de la clé FN, piste suivante, dernière piste, lecture/pause, volume +, volume -, touche secret, Blocage de la clé WIN",,,,,,,Garantie de 2 ans,,,,USB,,,,Oui,,,AZERTY Français,,,,,,,,,,,,,,,,,,,,,,,,,785 g,,,,,,Résistant à l'abrasion,,,,,,,,,,,,RGB / 16 millions de couleurs,,,,,,,,,,,,,Filaire,,,,,,,,,,,CHERRY MX2A Red,,,,,,,,,,
11261144,XtremeMac,MCL SAMAR,Adaptateur USB - 24 pin USB-C (M) pour USB type A (F) - USB 3.0 - 3 A,5.83,,,,,,,,,,,,,,,,,,,,,24 pin USB-C - mâle,USB 9 broches type A - femelle,,,,,,3 A,,,,,,,,,,,,,,"Support de charge rapide, synchronisation et charge",,,,,,,,,,,,,,,,,,,,,,,,,,,,,,,,,USB 3.0,,,,,,,,,,,,,,,,,,,,,,,,,,,,,,,,,,,,,,,,,,,,,,Adaptateur de type C USB,,,,,,,,,,,,,,
11536907,CHERRY KW 7100 Mini,CHERRY,Clavier - sans fil - Bluetooth 5.1 - AZERTY - Français - commutateur : CHERRY SX - vert agave - emballage sans plastique,46.21,,,,,,,,,,,,,,,,,,,,,,,,,,,Vert agave,,,,,,,,,,,,,"Volume, lecture/pause, contrôle des médias",,,,,,,Garantie de 3 ans,,,,Bluetooth 5.1,,,,,,,AZERTY Français,,,,,,,,,,,,78,,,,,,,,,,,,,430 g,,,,,,,,,,,,Récepteur sans fil USB,,,,,,,,,,,,,,,,,,,Sans fil,,,,,,,,Emballage sans plastique,,,CHERRY SX,,,,,,,,,,
11536989,CHERRY XTRFY MX 3.1,CHERRY,Clavier - 100% - full size - rétroéclairé - USB-C - Français - commutateur : CHERRY MX2A Brown - blanc,116.81,,,,,,,,,,,,,,Oui,,,,,,,,,,,,,Blanc,,,,,,,,,,,,,Verrou clavier Windows,,,,,,,,,,,USB-C,,,,Oui,,,Français,,,,,,,,,,,,,,,,,,,,,,,,,1.12 kg,,,,,,Résistant à l'abrasion,,,,,,,,,,,,"RGB / 16,8 millions de couleurs",,,,,,,,,,,,,Filaire,,,,,,,,,,,CHERRY MX2A Brown,,,,,,,,,,
11536993,CHERRY STREAM CLAVIER TKL,CHERRY,Clavier - USB - AZERTY - Français - commutateur : CHERRY SX - gris pâle,30.24,,,,,,,,,,,,,,,,,,,,,,,,,,,Gris pâle,,,,,,,,,,,,,"Volume -, volume +, touche secret, piste précédente, lecture/pause, piste suivante",,,,,,,Garantie de 3 ans,,,,USB,,,,,,,AZERTY Français,,,,,,,,,,,,88,,,6,,,Blue Angel,,,,,,,680 g,,,,,,,,,,,,,,,,,,,,,,,,,,,,,,,Filaire,,,,,,,,,,,CHERRY SX,,,,,,,,,,
5103396,CLAVIER QWERTY USB NOIR,UNIFORMATI,UNIFORMATIC - CLAVIER QWERTY USB NOIR,21.76,,,,,,,,,,,,,,,,,,,,,,,,,,,,,,,,,,,,,,,,,,,,,,,,,,,USB,,,,,,,QWERTY US,,,,,,,,,,,,,,,,,,,,,,,,,,,,,,,,,,,,,,,,,,,,,,,,,,,,,,,,Filaire,,,,,,,,,,,,,,,,,,,,,
3416839,Cherry Compact-keyboard G84-4400 Français Gris USB,CHERRY,"Cherry Compact-keyboard G84-4400 Français Gris USBClavier miniature mécanique bas profil, trackball, 84 touches, layout FR",142.85,,,,,,,,,,,,,,,,,,,,,,,,,,,Gris clair,,,,,,,,,,,,,,,"Technologie Cherry ML, trackball intégrée",,,,,Garantie de 3 ans,,,,USB,,,,,,,Français,,,,,,,,,,,,84,,,,,,,,,,,,,0.7 kg,,,,,,,,,,,,,,,,,,,,,,,,,,,,,,,Filaire,,,,,,,,,,,,,,,,,,,,,
4167631,CHERRY G80-1800,CHERRY,"1800 - Clavier - PS/2, USB - Français - gris clair",105.03,,,,,,,,,,,Compatible with Windows 7,,,,,,,,,,,,,,,,Gris clair,,,,,,,,,,,,,,,Technologie Cherry MX,,,,,Garantie de 3 ans,,,,"PS/2, USB",,,,,,,Français,,,,,,,,,,,,105,,,,,,,,,,,,,0.92 kg,,,,,,,,,,,,,,,,,,,,,,,,,,,,,,,Filaire,,,,,,,,,,,,,,,,,,,,,
11509901,CHERRY K5V2,CHERRY,Clavier - 65% - compact TKL - rétroéclairage - USB - AZERTY - Français - commutateur : CHERRY MX2A Red (échangeable à chaud) - noir,116.81,,,,,,,,,,,,,,,,,,,,,,,,,,,Noir,,,,,,,,,,,,,"Luminosité, contrôle des médias, lecture/pause, volume +, volume -, touche secret",,,,,,,Garantie de 2 ans,,,,USB,,,,Oui,,,AZERTY Français,,,,,,,,,,,,,,,,,,,,,,,,,841 g,,,,,,,,,,,,,,,,,,Bande LED RGB,,,,,,,,,,,,,Filaire,,,,,,,,,,,CHERRY MX2A Red (échangeable à chaud),,,,,,,,,,
7713691,Lenovo Go Split,LENOVO,Clavier - sans fil - 2.4 GHz - US avec le symbole de l'euro - gris orage - Pour la vente au détail,118.0,,,,,,,,,,,,,,,,,,,,,,,,,,,Gris orage,,,,,,,,,,,,,,,,,,,,1 an de garantie,,,,2.4 GHz,,,,,,,US avec le symbole de l'euro,,,,,,,,,,,,88,,,,,,,,,,,,,890 g,,,,,,,,,,,,Récepteur sans fil USB,,,,,,,,,,Chiclet,,,,,,,,,Sans fil,,,,,,,,Pour la vente au détail,,,,,,,,,,,,,
11533090,HP 680 Comfort,HP INC,"Ensemble clavier et souris - bi-mode, agencement à 3 zones, multi-appareils, 23 touches programmables, détection automatique du système d'exploitation, déplacement des touches à profil bas - full size - sans fil - 2.4 GHz, Bluetooth - AZERTY - Français - noir",108.32,,,,,,,,,,,,,,Oui,,,,,,,,,,,,,Noir,,,,,Souris - sans fil,,,,,,,,"Dictée, Copilot, commutateur de langue",,,,,,,Garantie de 2 ans,,,,"2.4 GHz, Bluetooth",,,,,,,AZERTY Français,,,,,,,,,,,,,,,,,,,,,,,,,,,,,,,Résistant aux éclaboussures,,,,,,,,,,,,,,,,,,,,,,,,,Sans fil,,,,,,,,,,,,,,,,,,,,,
11533091,HP 680 Comfort,HP INC,"Clavier - bi-mode, agencement à 3 zones, multi-appareils, 23 touches programmables, détection automatique du système d'exploitation, déplacement des touches à profil bas - full size - sans fil - 2.4 GHz, Bluetooth - AZERTY - Français - noir",83.32,,,,,,,,,,,,,,Oui,,,,,,,,,,,,,Noir,,,,,,,,,,,,,"Dictée, Copilot, commutateur de langue",,,,,,,Garantie de 2 ans,,,,"2.4 GHz, Bluetooth",,,,,,,AZERTY Français,,,,,,,,,,,,,,,,,,,,,,,,,845 g,,,,,,Résistant aux éclaboussures,,,,,,,,,,,,,,,,,,,,,,,,,Sans fil,,,,,,,,,,,,,,,,,,,,,
11533092,HP 460,HP INC,"Clavier - multi-appareils, appairage rapide, compact avec pavé numérique, disposition à 2 zones - sans fil - Bluetooth 5.3 - Français - noir Jack",54.16,,,,,,,,,,,,,,Oui,,,,,,,,,,,,,Noir Jack,,,,,,,,,,,,,"Emoji, commutateur de langue, touche secret",,,,,,,Garantie de 2 ans,,,,Bluetooth 5.3,,,,,,,Français,,,,,,,,,,,,,,,,,,,,,,,,,660 g,,,,,,"Résistant aux éclaboussures, protection par cryptage",,,,,,,,,,,,,,,,,,,,,,,,,Sans fil,,,,,,,,,,,,,,,,,,,,,
11533093,HP 960,HP INC,"Ensemble clavier et pavé numérique - taille compacte, disposition à 2 zones, pavé numérique séparé, déplacement des touches à profil bas, multi-dispositifs - sans fil - Bluetooth - Français - noir",166.66,,,,,,,,,,,,,,Oui,,,,,,,,,,,,,Noir,,,,,Clavier - sans fil,,,,,,,,"Dictée, commutateur de langue, Copilot",,,,,,,1 an de garantie,,,,Bluetooth,,,,,,,Français,,,,,,,,,,,,,,,,,,,,,,,,,,,,,,,,,,,,,Récepteur sans fil USB,,,,,,,,,,,,,,,,,,,Sans fil,,,,,,,,,,,,,,,,,,,,,
11533096,HP 480 Comfort,HP INC,"Clavier - Agencement à 3 zones, multi-appareils, 23 touches programmables - full size - USB - AZERTY - Français - noir",64.8,,,,,,,,,,,,,,Oui,,,,,,,,,,,,,Noir,,,,,,,,,,,,,"Dictée, Copilot, commutateur de langue",,,,,,,Garantie de 2 ans,,,,USB,,,,,,,AZERTY Français,,,,,,,,,,,,,,,,,,,,,,,,,870 g,,,,,,Résistant aux éclaboussures,,,,,,,,,,,,,,,,,,,,,,,,,Filaire,,,,,,,,,,,,,,,,,,,,,
3480576,DELL KB216,DELL,"ClavierUSBfrançais (AZERTY)noirpour Inspiron 17 5759, 3459, Precision Mobile Workstation 3510, 5510, 7510, 7710, Vostro 3905pour Wyse",19.75,,,,,,,,,,,,,,,,,,,,,,,,,,,Noir,,,,,,,,,,,,,"Volume, touche secret, lecture/pause, arrière, avant",,,,,,,1 an de garantie,,,,USB,,,,,,,AZERTY Français,,,,,,,,,,,,,,,,,,,,,,,,,503 g,,,,,,,,,,,,,,,,,,,,,,Chiclet,,,,,,,,,Filaire,,,,,,,,,,,,,,,,,,,,,
3483153,Dell KB216,DELL,Clavier - USB - QWERTY - International US - noir,19.75,,,,,,,,,,,,,,,,,,,,,,,,,,,Noir,,,,,,,,,,,,,"Volume, lecture/pause, arrière, avant",,,,,,,1 an de garantie,,,,USB,,,,,,,QWERTY International US,,,,,,,,,,,,,,,,,,,,,,,,,,,,,,,,,,,,,,,,,,,,,,,Chiclet,,,,,,,,,Filaire,,,,,,,,,,,,,,,,,,,,,
11835957,Belkin Pack Clavier et Souris Sans-Fil Wireless,BELKIN,Ensemble clavier et souris - full size - sans fil - 2.4 GHz - AZERTY - Français,24.99,,,,,,,,,,,,,,Oui,,,,,,,,,,,,,,,,,,Souris - sans fil - optique,,,,,,,,Multimédia,,,,,,,Garantie de 2 ans,,,,2.4 GHz,,,,,,,AZERTY Français,,,,,,,,,,,,,,3,,,,,,,,,,,,,,,,,"Anti-déversement, résistant aux accidents",,,,,,Récepteur sans fil USB,,,,,,,,,,,,,,,,,,,Sans fil,,,,,,,,,,,,,,,,,,,,,
7754298,Dell KB740,DELL,"Clavier - compact, multi-dispositif - sans fil - 2.4 GHz, Bluetooth 5.0 - QWERTY - International US - gris titan - avec 3 years NBD Advance Exchange",46.75,,,,,,,,,,,,,,Oui,,,,,,,,,,,,,Gris titan,,,,,,,,,,,,,"Programmable, volume -, volume +, touche secret",,,,,,,,,,,"2.4 GHz, Bluetooth 5.0",,,,,,,QWERTY International US,,,,,,,,,,,,,,,,,,,,,,,,,506 g,,,,,,,,,,,,Récepteur sans fil USB,,,,,,,3 years NBD Advance Exchange,,,,,,,,,,,,Sans fil,,,,,,,,,,,,,,,,,,,,,
11916788,HP 455,HP INC,Clavier - programmable - sans fil - 2.4 GHz - Français - noir,633.0,,,,,,,,,,,,,,Oui,,,,,,,,,,,,,Noir,,,,,,,,,,,,,,,,,,,,1 an de garantie,,,,2.4 GHz,,,,,,,Français,,,,,,,,,,,,,,,,,,,,,,,,,430 g,,,,,,,,,,,,Récepteur sans fil USB,,,,,,,,,,,,,,,,,,,Sans fil,,,,,,,,,,,,,,,,,,,,,
11916794,HP 125 G2,HP INC,Clavier - 100% - full size - USB - AZERTY - Français - noir - En vrac,188.0,,,,,,,,,,,,,,Oui,,,,,,,,,,,,,Noir,,,,,,,,,,,,,"Verrouillage du PC, touche de raccourci, Caps Lock, Copilot",,,,,,,1 an de garantie,,,,USB,,,,,,,AZERTY Français,,,,,,,,,,,,,,,,,,,,,,,,,460 g,,,,,,,,,,,,,,,,,,,,,,,,,,,,,,,Filaire,,,,,,,,En vrac,,,,,,,,,,,,,
11916795,HP 655,HP INC,Ensemble clavier et souris - sans fil - 2.4 GHz - Français - noir,841.0,,,,,,,,,,,,,,Oui,,,,,,,,,,,,,Noir,,,,,Souris - sans fil,,,,,,,,,,,,,,,1 an de garantie,,,,2.4 GHz,,,,,,,Français,,,,,,,,,,,,,,,,,,,,,,,,,,,,,,,,,,,,,Récepteur sans fil USB,,,,,,,,,,,,,,,,,,,Sans fil,,,,,,,,,,,,,,,,,,,,,
11916796,HP 320K v2,HP INC,Clavier - USB - AZERTY - Français - En vrac (pack de 12),240.0,,,,,,,,,,,,,,,,,,,,,,,,,,,,,,,,,,,,,,,,,,,,,,,,,,,USB,,,,,,,AZERTY Français,,,,,,,,,,,,,,,,,,,,,,,,,,,,,,,,,,12 (les spécifications se rapportent à un seul article),,,,,,,,,,,,,,,,,,,,,,Filaire,,,,,,,,En vrac,,,,,,,,,,,,,
11916797,HP 225,HP INC,"Ensemble clavier et souris - ambidextre, disposition en 3 zones, course de touche standard - 100% - full size - USB - AZERTY - Français - blanc",33.0,,,,,,,,,,,,,,Oui,,,,,,,,,,,,,Blanc,,,,,Souris - filaire - optique,,,,,,,,"Num lock, Caps Lock, Copilot",,,,,,,1 an de garantie,,,,USB,,,,,,,AZERTY Français,,,,,,,,,,,,,,3,,,,,,,,,,,,,,,,,,,,,,,,,,,,,,,,,,,,,,,,,,Filaire,,,,,,,,,,,,,,,,,,,,,
7417238,HP Premium,HP INC,Clavier - avec ClickPad - rétroéclairé - POGO pin - Français - pour Elite x2 G8,343.0,,,,,,,ClickPad,,,,,,,,,,,,,,,,,,,Elite x2 G8,,,,,,,,,,,,,,,,,,,,,1 an de garantie,,,,POGO pin,,,,,,,Français,,,,,,,,,,,,,,,,,,,,,,,,,360 g,,,,,,"Résistant aux éclaboussures, résistant à l'usure, résistant aux déchirures",,,,,,,,,,,,Oui,,,,,,,,,,,,,,,,,,,,,,,,,,,,,,,,,,
9821987,Lenovo Essential Wireless Combo Gen 2,LENOVO,Ensemble clavier et souris - sans fil - 2.4 GHz - Français - noir - boîte en carton - CRU,46.0,,,,,,,,,,,,,,Oui,,,,,,,,,,,,,Noir,,,,,Souris - sans fil - optique - droitiers et gauchers,,,,,,,,Contrôle des médias,,,,,,,Garantie de 3 ans,,,,2.4 GHz,,,,,,,Français,,,,,,,,,,,,,,3,,,,,,3 millions de clics,,,,,,,,,,,Résistant aux éclaboussures,,,,,,Nano récepteur sans fil USB,,,,,,,,,,,,,,,,,,,Sans fil,,,,,,,,Boîte en carton,,,,,,,,,,Customer-replaceable Unit (CRU),,,
11869481,HP Desktop 320K,HP INC,Clavier - USB - Français - Smart Buy,16.0,,,,,,,,,,,,,,,,,,,,,,,,,,,,,,,,,,,,,,,,,,,,,,,,,,,USB,,,,,,,Français,,,,,,,,,,,,,,,,,,,,,,,,,,,,,,HP Smart Buy,,,,,,,,,,,,,,,,,,,,,,,,,,Filaire,,,,,,,,,,,,,,,,,,,,,
7739112,Logitech Master Series MX Mechanical Mini for Mac,LOGITECH,Clavier - rétroéclairé - sans fil - Bluetooth LE - AZERTY - Français - commutateur : Tactile Silencieux - gris pâle,159.99,,,,,,,,,,,,,,,,,,,,,,,,,,,Gris pâle,,,,,,,,,,,,,"Easy-Switch, multimédia, interrupteur marche/arrêt",,,,,,,Garantie de 2 ans,,,,Bluetooth LE,,,,,,,AZERTY Français,,,,,,,,,,,,,,,,,,,,,,,,,612 g,,,,,,,,,,,,,,,,,,Oui,,,,,,,,,,,,,Sans fil,,,,,,,,,,,Tactile Silencieux,,,,,,,,,,
