id,nom,marque,caracteristiques,prix,Affichage,Ajustements,Alimentation,Alimentation fournie,Ancrable,Appareil d'entrée,Appareils intégrés,Avertissement sur les couleurs de l'image,Batterie,Caractéristiques,Certification Microsoft,Certification du logiciel,Classe énergétique,Clavier numérique,Commandes,Compatibilité,Compatibilité TTA,Compatibilité de la taille de l'écran,Compatibilité ordinateur portable,Configuration requise,Connecteur,Connecteur (deuxième extrémité),Connecteurs d'entrée,Contenu de l'emballage,Contenu recyclé du produit,Conçu pour,Couleur,Courant nominal,Destiné à,Dimension Rack,Dimensions d'ordinateur portable prises en charge,Dispositif de pointage,Dispositifs de sécurité,Débit de transfert de données,Effets sonores,Empreinte carbone,Epaisseur,Facteur de forme,Facteur de forme du casque,Fonction de raccourcis clavier,Fonctionne avec Chromebook,Fonctions,Fonctions supplémentaires,Format,Fourni avec,Gamme de couleurs,Garantie du fabricant,Hauteur (unités de rack),Impédance,Inclinaison,Interface,Interface de montage VESA,Interface de station d'accueil,Interfaces vidéo,Jeu,Lavable,Localisation,Localisation et disposition,Longueur,Longueur du câble,Luminosité,Matière du boîtier,Matériau,Matériau du produit,Microphones fournis,Mode de fonctionnement des appareils électriques,Mode de fonctionnement du microphone,Mode de sortie audio,Multipoint,Nbre de touches,Nombre de boutons,Nombre de touches,Nombre de touches spéciales,Nombre inclus,Normes de conformité,Normes environnementales,Panoramique,Performance,Performances,Pistes de la carte ISO,Pivoter,Pliable,Poids,Poids de la charge max.,Positionnement/montage,Processeur,Profondeur réglable,Programme de ventes par le fabricant,Protection,Protocole de liaison de données,Puissance d'entrée max.,Quantité emballée,Rapport de contraste,Revêtement de l'écran,Récepteur sans fil,Réglages de la position de l'écran,Réseaux,Résolution,Résolution native,Rétroéclairage du clavier,Rétroéclairé,Services inclus,Spécifications audio,Stockage,Style de touches,Suppresseur de bruit actif,Suppression du bruit de microphone,Système d'exploitation,Système d'exploitation requis,Taille,Technologie Adaptive-Sync,Technologie de casque,Technologie de charge rapide,Technologie de connectivité,Technologie de détection de mouvements,Technologie du microphone,Technologie sans fil,Temps de réponse,Tension,Tension requise,Type,Type d'emballage,Type d'interface (bus),Type de Produit,Type de contacts,Type de diaphragme,Type de licence,Type de microphone,Type de panneau,Type de prise,Type de rack,Type de tarification,Utilisation recommandée,Webcam intégrée,Éléments de montage
2028281,Logitech K120,LOGITECH,Logitech Keyboard K120 - Clavier - USB - version OEM,15.99,,,,,,,,,,,Compatible with Windows 7,,,,,,,,,,,,,,,,,,,,,,,,,,,,,,,Étanche,,,,,,,,,USB,,,,,,,Français,,,,,,,,,,,,,,,,,,,,,,,,,0.55 kg,,,,,,,,,,,,,,,,,,,,,,,,,,,,,,,Filaire,,,,,,,,,,,,,,,,,,,,,
7412549,HP 150,HP INC,"Ensemble clavier et souris - USB - Français - noir - pour HP 21, 22, 24, 27; Pavilion 24, 27, TP01; Pavilion Laptop 13, 14, 15",27.0,,,,,,,,,,,,,,,,,,,,,,,,,,"HP 21, 22, 24, 27; Pavilion 24, 27, TP01; Pavilion Laptop 13, 14, 15",Noir,,,,,Souris,,,,,,,,"E-mail, volume, page d'accueil, musique, films, signets",,,,,,,1 an de garantie,,,,USB,,,,,,,Français,,,,,,,,,,,,,,,,,,,,,,,,,,,,,,,,,,,,,,,,,,,,,,,,,,,,,,,,Filaire,,,,,,,,,,,,,,,,,,,,,
11770948,Philips 4000 series SPT6407B,PHILIPSMMD,"Ensemble clavier et souris - sans fil - 2.4 GHz, Bluetooth 3.0, Bluetooth 5.0",34.11,,,,,,,,,,,,,,Oui,,,,,,,,,,,,,,,,,,Souris - sans fil - optique - droitiers et gauchers,,,,,,,,,,,,,,,,,,,"2.4 GHz, Bluetooth 3.0, Bluetooth 5.0",,,,,,,,,,,,,,,,,,,110,,4,,,,,,3 millions de clics,,,,,,,,,,,,,,,,,Récepteur sans fil USB,,,,,,,,,,,,,,,,,,,Sans fil,,,,,,,,,,,,,,,,,,,,,
5720389,Clavier Typecover pour Surface Go - Noir,MICROSOFT,"Clavier - avec trackpad, accéléromètre - rétroéclairé - Français - noir - commercial - Compatible sur toute la gamme Surface GO",87.47,,,,,,,"Trackpad, accéléromètre",,,,,,,,,,,,,,,,,,,"Surface Go, Go 2",Noir,,,,,,,,,,,,,"Multimédia, luminosité, raccourcis Windows",,,,,,,1 an de garantie,,,,,,,,,,,Français,,,,,,,,,,,,,,,,,,,,,,,,,245 g,,,,,,,,,,,,,,,,,,Oui,,,,,,,,,,,,,,,,,,,,,,,,,,,,,,,Commercial,,,
6359176,Dell Pro Keyboard and Mouse KM5221W,DELL,"Ensemble clavier et souris - sans fil - 2.4 GHz - Français AZERTY - noir - pour Precision 7560, XPS 13 9310, 15 9510",44.5,,,,,,,,,,,,,,,,,,,,,,,,,,"Precision 7560; XPS 13 9310, 15 9510",Noir,,,,,Souris - sans fil - optique,,,,,,,,"Volume, touche secret",,,,,,,,,,,2.4 GHz,,,,,,,Français canadien,,,,,,,,,,,,,,3,,,,,,,,,,,,,,,,,,,,,,,Récepteur sans fil USB,,,,,,,3 years NBD Advance Exchange,,,,,,,,,,,,Sans fil,,,,,,,,,,,,,,,,,,,,,
6359175,Dell Pro Plus Keyboard and Mouse KM7321W,DELL,"Ensemble clavier et souris - sans fil - 2.4 GHz, Bluetooth 5.0 - AZERTY - Français - gris titan - avec 3 years NBD Advance Exchange - pour Precision 7560; XPS 13 9310, 15 9510",82.5,,,,,,,,,,,,,,,,,,,,,,,,,,"Precision 7560; XPS 13 9310, 15 9510",Gris titan,,,,,Souris - sans fil - optique,,,,,,,,"Volume, touche secret",,,,,,,,,,,"2.4 GHz, Bluetooth 5.0",,,,,,,AZERTY Français,,,,,,,,,,,,,,7,,,,,,,,,,,,,,,,,,,,,,,Récepteur sans fil USB,,,,,,,3 years NBD Advance Exchange,,,,,,,,,,,,Sans fil,,,,,,,,,,,,,,,,,,,,,
4455125,MCL - Kit clavier + souris USB - Noir,MCL SAMAR,2012/N - Ensemble clavier et souris - USB - AZERTY - Français - noir,12.32,,,,,,,,,,,,,,Oui,,,,,,,,,,,,,Noir,,,,,Souris - filaire - optique,,,,,,,,,,,,,,,,,,,USB,,,,,,,AZERTY Français,,,,,,,,,,,,,,3,,,,,,,,,,,,,,,,,,,,,,,,,,,,,,,,,,,,,,,,,,Filaire,,,,,,,,,,,,,,,,,,,,,
11511472,HP 725,HP INC,"Ensemble clavier et souris - multi-appareils, rechargeable, alimenté par SuperCapacitor - full size - sans fil - 2.4 GHz, Bluetooth - Français - noir tombée de nuit - Smart Buy",95.4,,,,,,,,,,,,,,Oui,,,,,,,,,,,,,Noir tombée de nuit,,,,,Souris - sans fil,,,,,,,,"Dictée, Copilot, verrouillage du PC, calculatrice",,,,,,,1 an de garantie,,,,"2.4 GHz, Bluetooth",,,,,,,Français,,,,,,,,,,,,,,,,,,,,,,,,,,,,,,HP Smart Buy,Résistant aux éclaboussures,,,,,,Récepteur sans fil USB,,,,,,,,,,,,,,,,,,,Sans fil,,,,,,,,,,,,,,,,,,,,,
7449701,Logitech Signature MK650 Combo for Business,LOGITECH,Logitech - Signature MK650 Combo for Business - Graphite - Français,84.99,,,,,,,,,,,,,,Oui,,,,,,,,,,,,,Graphite,,,,,Souris - sans fil,,,,,,,,"Dictée, Emoji, écran de découpage, coupure du microphone, fonction arrière, actualisation, Tab, imprimé, calculatrice, commutateur de langue",Oui,,,,,,Garantie de 2 ans,,,,Bluetooth LE,,,,,,,AZERTY Français,,,,,,,,,,,,,,5,6,,,,,Commutation de sensibilité en temps réel 400 - 4 000 dpi,,,,,,,,,,,,,,,,,Récepteur USB Logitech Logi Bolt,,,,,,,,,,,,,,,,,,,Sans fil,,,,,,,,,,,,,,,,,,,,,
5690342,Dell Pro Plus Compact Keyboard and Mouse,DELL,"KM7120W - Ensemble clavier et souris - sans fil - 2.4 GHz, Bluetooth 5.0 - Français - gris titan - avec 3 years NBD Advance Exchange - pour Latitude 9410; OptiPlex 7480; Precision 3640, 7560; Vostro 5502; XPS 13 9310, 15 9510",73.25,,,,,,,,,,,,,,,,,,,,,,,,,,"Latitude 3510, 9410, 9510; OptiPlex 7480 All In One; Precision 3640 Tower, 7560; Vostro 3491, 3591, 5502; XPS 13 9310, 15 9510",Gris titan,,,,,Souris - sans fil - optique,,,,,,,,"Multimédia, recherche, page d'accueil, volume -, volume +, écran d'impression",,,,,,,,,,,"2.4 GHz, Bluetooth 5.0",,,,,,,Français,,,,,,,,,,,,,,7,,,,,,,,,,,,,,,,,,,,,,,,,,,,,,3 years NBD Advance Exchange,,,,,,,,,,,,Sans fil,,,,,,,,,,,,,,,,,,,,,
11841005,HP,HP INC,"Clavier - rétro-éclairé - USB - AZERTY - Français - noir - pour Victus by HP Laptop 16; HP 250 G9; Laptop 14, 15, 17; Pavilion Plus Laptop 14; Pro 290 G9",72.0,,,,,,,,,,,,,,Oui,,,,,,,,,,,,"Victus by HP Laptop 15, 16; HP 250 G9; Elite 600 G9, 800 G9; EliteDesk 800 G6; Laptop 14, 15, 15s, 17; Pavilion Plus Laptop 14; Pro 290 G9",Noir,,,,,,,,,,,,,"Multimédia, volume, profil, contrôle du rétroéclairage, mode de touche de jeu",,,,,,,Garantie de 2 ans,,,,USB,,,,Oui,,,AZERTY Français,,,,,,,,,,,,,,,,,,,,,,,,,1.121 kg,,,,,,Résistant aux éclaboussures,,,,,,,,,,,,5 zones RGB,,,,,,,,,,,,,Filaire,,,,,,,,,,,,,,,,,,,,,
11841003,HyperX,HP INC,Repose-poignet pour clavier - pleine taille - noir,24.0,,,,,,,,,,,,,,,,,,,,,,,,,,,Noir,,,,,,,,,,,,,,,,,,,,Garantie de 2 ans,,,,,,,,,,Français / France,,,,,,,"Mousse viscoélastique, Cool-Gel",,,,,,,,,,,,,,,,,,,311 g,,,,,,,,,,,,,,,,,,,,,,,,,,,,,,,,,,,,,,,,,,,,,,,,,,,,
2361620,Clavier sans fil Logitech K270,LOGITECH,Clavier - sans fil - 2.4 GHz - Allemand,39.99,,,,,,,,,,,Compatible with Windows 7,,,,,,,,,,,,,,,,,,,,,,,,,,,,,"Exploration internet, e-mail, volume, lecture/pause",,"Récepteur Logitech Unifying, résistant aux liquides",,,,,Garantie de 3 ans,,,,2.4 GHz,,,,,,,Allemand,,,,,,,,,,,,,,,8,,,,,,,,,,,,,,,,,,,,,,Récepteur sans fil USB,,,,,,,,,,,,,,,,,,,Sans fil,,,,,,,,,,,,,,,,,,,,,
2411572,Ensemble sans fil Logitech MK330,LOGITECH,Ensemble clavier et souris - sans fil - 2.4 GHz - Français - noir,59.99,,,,,,,,,,"Commutateur de mise sous tension / hors tension, Résolution 1 000 dpi",,,,,,,,,,,,,,,,,Noir,,,,,Souris - optique,,,,,,,,"Veille, changement d'application, poste de travail, e-mail, volume, recherche, touche secret, afficher le bureau, Verrouiller l'ordinateur, lecture/pause, piste précédente, piste suivante, lecteur multimédia",,,,,,,Garantie de 3 ans,,,,2.4 GHz,,,,,,,Français,,,,,,,,,,,,,,3,17,,,,,,,,,,,,,,,,,,,,,,Récepteur sans fil USB,,,,,,,,,,,,,,,,,,,Sans fil,,,,,,,,,,,,,,,,,,,,,
3467362,Clavier tactile sans fil Logitech K400 Plus,LOGITECH,Clavier - sans fil - 2.4 GHz - Français - noir,54.99,,,,,,,,,,,Compatible with Windows 7,,,,,,,,,,,,,,,,Noir,,,,,,,,,,,,,"Touche secret, Boutons de souris, volume -, volume +",,"Récepteur Logitech Unifying, bouton marche/arrêt, pavé tactile intégré",,,,,Garantie de 2 ans,,,,2.4 GHz,,,,,,,Français,,,,,,,,,,,,,,,,,,,,,,,,,390 g,,,,,,,,,,,,Récepteur sans fil USB,,,,,,,,,,,,,,,,,,,Sans fil,,,,,,,,,,,,,,,,,,,,,
9900224,Clavier surface Pro avec Stylet SC French France Comm Black,MICROSOFT,"Clavier - avec rangement pour stylos - avec accéléromètre, pavé tactile, plateau de stockage et de recharge du Surface Slim Pen - rétroéclairé - AZERTY - Français - noir - avec Slim Pen - pour Surface Pro 11, Pro 10, Pro 8, Pro 9.",261.32,,,,,,,"Accéléromètre, pavé tactile, plateau de stockage et de recharge du Surface Slim Pen",,,,,,,,,,,,,,,,,,,"Surface Pro 10 for Business, Pro 8 for Business, Pro 9 for Business, Pro X for Business",Noir,,,,,,,,,,,,,"Copilot, coupure du microphone, écran de découpage, raccourcis Windows, luminosité, multimédia",,,,,Slim Pen,,1 an de garantie,,,,,,,,,,,AZERTY Français,,,,,,,,,,,,,,,,,,,,,,,,,281 g,,,,,,,,,,,,,,,,,,Oui,,,,,,,,,,,,,,,,,,,,,,,,,,,,,,,,,,
8426920,Logitech MX Keys S,LOGITECH,Clavier - rétroéclairé - sans fil - Bluetooth LE - AZERTY - Français - commutateur : commutateurs à clé à ciseaux - graphite,119.99,,,,,,,,,,,,,,Oui,,,,,,,,,,,,,Graphite,,,,,,,,,,,,,"Easy-Switch, PerfectStroke, interrupteur marche/arrêt, multimédia, contrôle du rétroéclairage, dictée, Emoji, coupure d'écran",,,,,,,Garantie de 2 ans,,,,Bluetooth LE,,,,,,,AZERTY Français,,,,,,,,,,,,,,,,,,,,,,,,,810 g,,,,,,,,,,,,Récepteur USB Logitech Logi Bolt,,,,,,Oui,,,,,,,,,,,,,Sans fil,,,,,,,,,,,Commutateurs à clé à ciseaux,,,,,,,,,,
11841019,HP,HP INC,"Souris - optique - 6 boutons - filaire - USB 2.0 - pour Victus by HP Laptop 16; Laptop 14, 15, 17; Pavilion x360 Laptop; Pro 290 G9",72.0,,,,,,,,,,"Micro interrupteur TTC Golden étanche à la poussière, base en polytétrafluoroéthylène (PTFE), Capteur optique Pixart 3335, LED couleur RGB, conception de coque ultralégère",,,,,,,,,,,,,,,,"Victus by HP Laptop 15, 16; HP 250 G9; Elite 800 G9; EliteDesk 800 G6; Laptop 14, 15, 15s, 17; Pavilion Plus Laptop 14; Pavilion x360 Laptop; Pro 290 G9",,,,,,,,,,,,,,,,,,,,,Garantie de 2 ans,,,,,,,,,,,,,1.8 m,,,,,,,,,,,6,,,,,,,,"Commutation de sensibilité en temps réel 400/800/1 600/3 200 ppp, 60 millions de clics, temps de réponse : 1 000 Hz",,,,59 g,,,,,,,,,,,,,,,16000 dpi,,,,,,,,,,,,,,,,Filaire - USB 2.0,Optique,,,,,,,,,,,,,,,,,,,,
7754377,Dell KB500,DELL,Clavier - sans fil - 2.4 GHz - AZERTY - Français - noir - avec 3 years NBD Advance Exchange,34.75,,,,,,,,,,,,,,Oui,,,,,,,,,,,,,Noir,,,,,,,,,,,,,,,,,,,,,,,,2.4 GHz,,,,,,,AZERTY Français,,,,,,,,,,,,,,,,,,,,,,,,,400 g,,,,,,,,,,,,Récepteur sans fil USB,,,,,,,3 years NBD Advance Exchange,,,,,,,,,,,,Sans fil,,,,,,,,,,,,,,,,,,,,,
4881394,HP Pavilion 300 Keyboard,HP INC,HP Pavilion Wired Keyboard 300 FR,37.49,,,,,,,,,,,,,,,,,,,,,,,,,,,Noir de jais,,,,,,,,,,,,,,,,,,,,,,,,USB,,,,,,,Français,,,,,,,,,,,,,,,,,,,,,,,,,,,,,,,,,,,,,,,,,,,,,,,,,,,,,,,,Filaire,,,,,,,,,,,,,,,,,,,,,
5812085,Logitech Slim Wireless Combo MK470,LOGITECH,Ensemble clavier et souris - sans fil - 2.4 GHz - Français - blanc cassé,59.99,,,,,,,,,,,,,,Oui,,,,,,,,,,,,,Blanc cassé,,,,,Souris - sans fil - optique - droitiers et gauchers,,,,,,,,,,,,,,,Garantie de 2 ans,,,,2.4 GHz,,,,,,,Français,,,,,,,,,,,,,,3,,,,,,,,,,,,,,,,,,,,,,,Nano récepteur sans fil USB,,,,,,,,,,,,,,,,,,,Sans fil,,,,,,,,,,,,,,,,,,,,,
7449699,Logitech Signature MK650 Combo for Business,LOGITECH,Ensemble clavier et souris - sans fil - Bluetooth LE - QWERTZ - Allemand - graphite,84.99,,,,,,,,,,,,,,Oui,,,,,,,,,,,,,Graphite,,,,,Souris - sans fil,,,,,,,,"Dictée, Emoji, écran de découpage, coupure du microphone, fonction arrière, actualisation, Tab, imprimé, calculatrice, commutateur de langue",Oui,,,,,,Garantie de 2 ans,,,,Bluetooth LE,,,,,,,QWERTZ Allemand,,,,,,,,,,,,,,5,6,,,,,Commutation de sensibilité en temps réel 400 - 4 000 dpi,,,,,,,,,,,,,,,,,Récepteur USB Logitech Logi Bolt,,,,,,,,,,,,,,,,,,,Sans fil,,,,,,,,,,,,,,,,,,,,,
11841004,HP,HP INC,Clavier - rétroéclairé - USB - AZERTY - Français - commutateur : HyperX Red - noir,144.0,,,,,,,,,,,,,,Oui,,,,,,,,,,,,,Noir,,,,,,,,,,,,,Multimédia,,,,,,,Garantie de 2 ans,,,,USB,,,,Oui,,,AZERTY Français,,,,,,,,,,,,,,,,,,,,,,,,,1.075 kg,,,,,,,,,,,,,,,,,,"RGB / 16,7 millions de couleurs",,,,,,,,,,,,,Filaire,,,,,,,,,,,HyperX Red,,,,,,,,,,
5566365,CHERRY STREAM CLAVIER,CHERRY,Clavier - USB - Français - commutateur : CHERRY SX - blanc grisé,31.08,,,,,,,,,,,,,,Oui,,,,,,,,,,,,,Blanc grisé,,,,,,,,,,,,,"E-mail, volume, touche secret",,,,,,,Garantie de 2 ans,,,,USB,,,,,,,Français,,,,,,,,,,,,105,,,10,,,Blue Angel,,,,,,,910 g,,,,,,Résistant aux éclaboussures,,,,,,,,,,,,,,,,,,,,,,,,,Filaire,,,,,,,,,,,CHERRY SX,,,,,,,,,,
11841028,HP,HP INC,"Tapis de souris - grand - noir - pour HP 250 G9; Laptop 15, 15s, 17; Pavilion 15; Portable 24, 27",24.0,,,,,,,,,,,,,,,,,,,,,,,,,,"HP 250 G9; Laptop 15, 15s, 17; Pavilion 15; Portable 24, 27",Noir,,,,,,,,,,,,,,,,,,,,Garantie de 2 ans,,,,,,,,,,,,,,,,,"Caoutchouc, chiffon, tissé",,,,,,,,,,,,,,,,,,,,,,,,,,,,,,,,,,,,,,,,,,,,,,Grand,,,,,,,,,,,,,,,,,,,,,,,,,
10400916,Clavier surface Pro Flex SC French France Comm Black,MICROSOFT,"Microsoft Surface Pro Flex Keyboard - Clavier - avec pavé tactile, accéléromètre, plateau de rangement et de chargement du Surface Slim Pen 2 - rétroéclairé - sans fil - Bluetooth LE - AZERTY - Français - noir",350.74,,,,,,,"Pavé tactile, accéléromètre, plateau de rangement et de chargement du Surface Slim Pen 2",,,,,,,,,,,,,,,,,,,,Noir,,,,,,,,,,,,,"Luminosité, raccourcis Windows, contrôle des médias, coupure du microphone, clé Copilot",,,,,,,1 an de garantie,,,,Bluetooth LE,,,,,,,AZERTY Français,,,,,,,,,,,,,,,,,,,,,,,,,340 g,,,,,,,,,,,,,,,,,,Oui,,,,,,,,,,,,,Sans fil,,,,,,,,,,,,,,,,,,,,,
7754380,Dell Multi-Device KB700,DELL,"Device KB700 - Clavier - sans fil - 2.4 GHz, Bluetooth 5.0 - AZERTY - Français - gris - avec 3 years NBD Advance Exchange",57.5,,,,,,,,,,,,,,Oui,,,,,,,,,,,,,Gris,,,,,,,,,,,,,,,,,,,,,,,,"2.4 GHz, Bluetooth 5.0",,,,,,,AZERTY Français,,,,,,,,,,,,,,,,,,,,,,,,,654 g,,,,,,,,,,,,Récepteur sans fil USB,,,,,,,3 years NBD Advance Exchange,,,,,,,,,,,,Sans fil,,,,,,,,,,,,,,,,,,,,,
9725601,Mobilis Origine,MOBILIS,"Clavier et étui (étui de protection folio) - sans fil - Bluetooth - AZERTY - Français - noir clavier, noir étui",53.33,,,,,,,,,,,,,,,,,,,,,,,,,,,"Noir clavier, noir étui",,,,,,,,,,,,,,,,,,,,Garantie de 2 ans,,,,Bluetooth,,,,,,,AZERTY Français,,,,Cuir artificiel,,,,,,,,,,,,,,,,,,,,,504 g,,,,,,Protection contre les chutes,,,,,,,,,,,,,,,,,,,,,,,,,Sans fil,,,,,,,,,,,,,,,,,,,,,
6311959,HP 230 Ensemble clavier et souris - sans fil -  Noir,HP INC,"Ensemble clavier et souris - sans fil - Français - Noir pour HP 21, 22, 24, 27, Pavilion 24, 27, TP01, Portable 14, 15",45.0,,,,,,,,,,,,,,,,,,,,,,,,,,"HP 21, 22, 24, 27; Pavilion 24, 27, TP01; Pavilion Laptop 14, 15",,,,,,Souris - sans fil,,,,,,,,,,,,,,,Garantie de 2 ans,,,,,,,,,,,Français,,,,,,,,,,,,,,,,,,,,,,,,,,,,,,,,,,,,,,,,,,,,,,,,,,,,,,,,Sans fil,,,,,,,,,,,,,,,,,,,,,
2362215,Logitech Wireless Keyboard K270 - Français,LOGITECH,Clavier - sans fil - 2.4 GHz - françaisclavier francais,39.99,,,,,,,,,,,Compatible with Windows 7,,,,,,,,,,,,,,,,,,,,,,,,,,,,,"Exploration internet, multimédia, e-mail, volume, lecture/pause",,"Récepteur Logitech Unifying, résistant aux liquides",,,,,,,,,2.4 GHz,,,,,,,Français,,,,,,,,,,,,,,,8,,,,,,,,,,,,,,,,,,,,,,Récepteur sans fil USB,,,,,,,,,,,,,,,,,,,Sans fil,,,,,,,,,,,,,,,,,,,,,
11869483,HP 655,HP INC,Ensemble clavier et souris - 100% - full size - sans fil - 2.4 GHz - Français - noir - Smart Buy,48.0,,,,,,,,,,,,,,Oui,,,,,,,,,,,,,Noir,,,,,Souris - sans fil,,,,,,,,"Touche secret, dictée, Emoji",,,,,,,1 an de garantie,,,,2.4 GHz,,,,,,,Français,,,,,,,,,,,,,,3,,,,,,,,,,,,,,,,HP Smart Buy,Résistant aux éclaboussures,,,,,,Récepteur sans fil USB,,,,,,,,,,,,,,,,,,,Sans fil,,,,,,,,,,,,,,,,,,,,,
6862521,Logitech MX Keys,LOGITECH,Logitech - MX Master Keys for Business - GRAPHITE - FRA,119.99,,,,,,,,,,,,,,Oui,,,,,,,,,,,,,Graphite,,,,,,,,,,,,,Easy-Switch,,,,,,,Garantie de 2 ans,,,,Bluetooth,,,,,,,AZERTY Français,,,,,,,,,,,,,,,,,,,,,,,,,810 g,,,,,,,,,,,,Récepteur USB Logitech Logi Bolt,,,,,,Oui,,,,,,,,,,,,,Sans fil,,,,,,,,,,,,,,,,,,,,,
7449720,Logitech Signature MK650 Combo for Business,LOGITECH,Ensemble clavier et souris - sans fil - Bluetooth LE - QWERTY - Nordique (Danois/Finnois/Norvégien/Suédois) - graphite,84.99,,,,,,,,,,,,,,Oui,,,,,,,,,,,,,Graphite,,,,,Souris - sans fil,,,,,,,,"Dictée, Emoji, écran de découpage, coupure du microphone, fonction arrière, actualisation, Tab, imprimé, calculatrice, commutateur de langue",Oui,,,,,,Garantie de 2 ans,,,,Bluetooth LE,,,,,,,QWERTY Nordique (Danois/Finnois/Norvégien/Suédois),,,,,,,,,,,,,,5,6,,,,,Commutation de sensibilité en temps réel 400 - 4 000 dpi,,,,,,,,,,,,,,,,,Récepteur USB Logitech Logi Bolt,,,,,,,,,,,,,,,,,,,Sans fil,,,,,,,,,,,,,,,,,,,,,
11841011,HP,HP INC,"Gaming - micro-casque - circum-aural - 2,4 GHz - sans fil - noir - pour Victus by HP Laptop 15, 16; EliteDesk 800 G6; Laptop 17; Pavilion x360 Laptop",144.0,,,,,,,,,,,,,,,"Volume, marche/arrêt du microphone",,,,,,,,,,,"Victus by HP Laptop 15-fa0014ns, 16-d0026nb, 16-e0314nf, 16-e1900ng; EliteDesk 800 G6; Laptop 17-cn2048nm; Pavilion x360 Laptop 15-er1003nm",Noir,,,,,,,,Casque DTS : X,,,,Circum-aural,,,,,,,,Garantie de 2 ans,,32 Ohm,,,,,,Oui,,,,,,,,,,,,Uni-directionnel,Stéreo,,,,,,,,,,,,,,,,,,,,,,,,,,,,,,,,,,,Réponse en fréquence 10 - 20200 Hz - Sensibilité 104.5 dB,,,,,,,,,Dynamique,,Sans fil,,Condensateur électret,"Fréquence radio 2,4 GHz",,,,,,,"Micro-casque - 2,4 GHz - sans fil",,,,Perche télescopique,,,,,"Console de jeux, ordinateur",,
10400707,HP 225,HP INC,"Clavier - disposition des zones 2,5 - sans fil - 2.4 GHz - Français - noir",30.8,,,,,,,,,,,,,,Oui,,,,,,,,,,,,,Noir,,,,,,,,,,,,,,,,,,,,1 an de garantie,,,,2.4 GHz,,,,,,,Français,,,,,,,,,,,,,,,,,,,,,,,,,425.5 g,,,,,,,,,,,,Récepteur sans fil USB,,,,,,,,,,Chiclet,,,,,,,,,Sans fil,,,,,,,,,,,,,,,,,,,,,
9900234,Clavier surface Pro SC French France Comm Platinum,MICROSOFT,"Clavier - avec rangement pour stylos - avec accéléromètre, pavé tactile, plateau de stockage et de recharge du Surface Slim Pen - rétroéclairé - AZERTY - Français - platine - pour Surface Pro 11, Pro 10, Pro 8, Pro 9.",168.32,,,,,,,"Accéléromètre, pavé tactile, plateau de stockage et de recharge du Surface Slim Pen",,,,,,,,,,,,,,,,,,,"Surface Pro 10 for Business, Pro 8 for Business, Pro 9 for Business",Platine,,,,,,,,,,,,,"Copilot, coupure du microphone, écran de découpage, raccourcis Windows, luminosité, multimédia",,,,,,,1 an de garantie,,,,,,,,,,,AZERTY Français,,,,,,,,,,,,,,,,,,,,,,,,,281 g,,,,,,,,,,,,,,,,,,Oui,,,,,,,,,,,,,,,,,,,,,,,,,,,,,,,,,,
1422024,CHERRY ML4100,CHERRY,"Clavier - PS/2, USB - QWERTY - US - noir",67.21,,,,,,,,,,,Compatible with Windows 7,,,,,,,,,,,,,,,,Noir,,,,,,,,,,,,,,,"Technologie Cherry ML, symbole monétaire de l'euro",,,,,Garantie de 3 ans,,,,"PS/2, USB",,,,,,,QWERTY US,,,,,,,,,,,,86,,,,,,,,,,,,,400 g,,,,,,,,,,,,,,,,,,,,,,,,,,,,,,,Filaire,,,,,,,,,,,,,,,,,,,,,
11841024,HP,HP INC,Clavier - 60% - rétroéclairé - USB-C - Français - commutateur : HyperX Red - rose,119.99,,,,,,,,,,,,,,,,,,,,,,,,,,,Rose,,,,,,,,,,,,,Renversement de la clé n,,,,,,,Garantie de 2 ans,,,,USB-C,,,,Oui,,,Français,,,,,,,,,,,,,,,,,,,,,,,,,781.5 g,,,,,,,,,,,,,,,,,,"RGB / 16,7 millions de couleurs",,,,,,,,,,,,,Filaire,,,,,,,,,,,HyperX Red,,,,,,,,,,
11869482,HP Business Slim v2,HP INC,Clavier - USB - Français - noir,63.0,,,,,,,,,,,,,,Oui,,,,,,,,,,,,,Noir,,,,,,Lecteur de carte à puce,,,,,,,"Copilot, verrouillage du défilement, Caps Lock",,,,,,,1 an de garantie,,,,USB,,,,,,,Français,,,,,,,,,,,,,,,,,,,,,,,,,600 g,,,,,,,,,,,,,,,,,,,,,,,,,,,,,,,Filaire,,,,,,,,,,,,,,,,,,,,,
7829617,"StarTech.com USB-C Multiport Adapter, 4K 60Hz HDMI, HDR, 3-Port USB Hub, 100W Power Delivery Pass-Through, USB Type C Mini Docking Station, Certified Works with Chromebook",STARTECH,"C Multiport Adapter, 4K 60Hz HDMI, HDR, 3-Port USB Hub, 100W Power Delivery Pass-Through, USB Type C Mini Docking Station, Certified Works with Chromebook - Windows, macOS, iPadOS, Android (104B-USBC-MULTIPORT) - Station d'accueil - USB-C / USB4 / Thunderbolt 3 / Thunderbolt 4 - HDMI",44.99,,,,,,,,,,,,,,,,,,,,,,,,,,,Gris sidéral,,,,,,,,,,,,,,Oui,,,,,,Garantie de 3 ans,,,,,,USB-C / USB4 / Thunderbolt 3 / Thunderbolt 4,HDMI,,,,,,,,,,,,,,,,,,,,,,,,,,,,,105 g,,,,,,,,,,,,,,,,,,,,,,,,,,,,,,,,,,,,,,,,,Station d'accueil,,,,,,,,,,,
10456006,Dell Pro Silent Wired Collaboration Keyboard KB525C,DELL,"Clavier - USB, USB-C - AZERTY - Français - noir - avec 3 years NBD Advance Exchange",40.25,,,,,,,,,,,,,,Oui,,,,,,,,,,,,,Noir,,,,,,,,,,,,,"Copilot, 15 touches de raccourci programmables, volume +, volume -, touche secret",,,,,,,,,,,"USB, USB-C",,,,,,,AZERTY Français,,,,,,,,,,,,,,,,,,,,,,,,,460 g,,,,,,Résistant aux éclaboussures,,,,,,,,,,,,,3 years NBD Advance Exchange,,,,,,,,,,,,Filaire,,,,,,,,,,,,,,,,,,,,,
6652308,HP 150 clavier et souris - USB - QWERTY,HP INC,"Ensemble clavier et souris - USB - QWERTY - Anglais - noir - pour HP 21, 27, Portable 14, 15, 15s",27.0,,,,,,,,,,,,,,,,,,,,,,,,,,"HP 21, 27; Laptop 14, 15, 15s; Pavilion Laptop 15",Noir,,,,,Souris,,,,,,,,"E-mail, volume, page d'accueil, musique, films, signets",,,,,,,1 an de garantie,,,,USB,,,,,,,QWERTY Anglais,,,,,,,,,,,,,,,,,,,,,,,,,,,,,,,,,,,,,,,,,,,,,,,,,,,,,,,,Filaire,,,,,,,,,,,,,,,,,,,,,
11841023,HyperX Alloy Origins Core,HP INC,Clavier - rétroéclairé - USB - Français - commutateur : HyperX Red - noir,180.0,,,,,,,,,,,,,,Oui,,,,,,,,,,,,,Noir,,,,,,,,,,,,,Multimédia,,,,,,,Garantie de 2 ans,,,,USB,,,,Oui,,,Français,,,,,,,,,,,,,,,,,,,,,,,,,900 g,,,,,,,,,,,,,,,,,,"RGB / 16,7 millions de couleurs",,,,,,,,,,,,,Filaire,,,,,,,,,,,HyperX Red,,,,,,,,,,
11841015,HP,HP INC,Micro-casque - circum-aural - filaire - noir,60.0,,,,,,,,,,,,,,,"Volume, microphone activé/désactivé",,,,,,,,,,,,Noir,,,,,,,,,,,,Circum-aural,,,,,,,,Garantie de 2 ans,,,,,,,,Oui,,,,,,,,,,,,,,,,,,,,,,,,,,,,,,,,,,,,,,,,,,,,,,,,Réponse en fréquence 10 - 25000 Hz - Sensibilité 95 dB,,,,Oui,,,,,Dynamique,,Filaire,,Condensateur électret,,,,,,,,Micro-casque - filaire,,,,Perche télescopique,,,,,"Console de jeux, ordinateur",,
10400920,Clavier surface Pro Flex avec stylet CM SC French France Black,MICROSOFT,"Microsoft Surface Pro Flex Keyboard - Clavier - avec pavé tactile, accéléromètre, plateau de rangement et de chargement du Surface Slim Pen 2 - rétroéclairé - sans fil - Bluetooth LE - AZERTY - Français - noir - avec Slim Pen",452.89,,,,,,,"Pavé tactile, accéléromètre, plateau de rangement et de chargement du Surface Slim Pen 2",,,,,,,,,,,,,,,,,,,,Noir,,,,,,,,,,,,,"Luminosité, raccourcis Windows, contrôle des médias, coupure du microphone",,,,,Slim Pen,,1 an de garantie,,,,Bluetooth LE,,,,,,,AZERTY Français,,,,,,,,,,,,,,,,,,,,,,,,,340 g,,,,,,,,,,,,,,,,,,Oui,,,,,,,,,,,,,Sans fil,,,,,,,,,,,,,,,,,,,,,
5769228,Logitech Slim Wireless Combo MK470,LOGITECH,Ensemble clavier et souris - sans fil - 2.4 GHz - Italien - blanc cassé,59.99,,,,,,,,,,,,,,Oui,,,,,,,,,,,,,Blanc cassé,,,,,Souris - sans fil - optique - droitiers et gauchers,,,,,,,,,,,,,,,Garantie de 2 ans,,,,2.4 GHz,,,,,,,Italien,,,,,,,,,,,,,,3,,,,,,,,,,,,,,,,,,,,,,,Nano récepteur sans fil USB,,,,,,,,,,,,,,,,,,,Sans fil,,,,,,,,,,,,,,,,,,,,,
8495396,Samsung Galaxy Tab Active4 Pro Clavier magnétique [Targus] Noir,SAMSUNG,JKT636TGB - Clavier - noir - pour Galaxy Tab Active4 Pro,108.29,,,,,,,,L'image du produit peut être d'une couleur différente,,,,,,,,,,,,,,,,,,Galaxy Tab Active4 Pro,Noir,,,,,,,,,,,,,,,,,,,,,,,,,,,,,,,,,,,,,,,,,,,,,,,,,,,,,,,,349 g,,,,,,,,,,,,,,,,,,,,,,,,,,,,,,,,,,,,,,,,,,,,,,,,,,,,
